show_id,title,director,cast,country,date_added,release_year,rating,content_category,preferences,Cluster
s1751,Dawson's Creek,Unknown Director,"James Van Der Beek, Katie Holmes, Michelle Williams, Joshua Jackson, Kerr Smith, Meredith Monroe, Busy Philipps, Mary Beth Peil",United States,"November 1, 2020",2002,TV-14,"TV Show - Romantic TV Shows, TV Dramas, Teen TV Shows",42,4
s1755,Forged in Fire,Unknown Director,Wil Willis,United States,"November 1, 2020",2019,TV-14,TV Show - Reality TV,56,4
s1756,Leah Remini: Scientology and the Aftermath,Unknown Director,"Leah Remini, Mike Rinder",United States,"November 1, 2020",2018,TV-14,TV Show - Docuseries,62,4
s1757,LEGO Jurassic World: Legend of Isla Nublar,Unknown Director,Unknown Cast,United States,"November 1, 2020",2019,TV-Y,TV Show - Kids' TV,52,0
s1758,LEGO Jurassic World: Secret Exhibit,Unknown Director,"Britt McKillip, Ian Hanlin, Dhirendra, Alex Zahara, Vincent Tong, Bethany Brown, Adrian Petriw, Sabrina Pitre",United States,"November 1, 2020",2018,TV-Y,TV Show - Kids' TV,70,4
s1759,LEGO Ninjago,Unknown Director,"Michael Adamthwaite, Paul Dobson, Kelly Metzger, Brent Miller, Kirby Morrow, Pauline Newstone, Vincent Tong, Sam Vincent",Canada,"November 1, 2020",2020,TV-Y7,TV Show - Kids' TV,55,4
s1760,LEGO Ninjago: Masters of Spinjitzu,Unknown Director,"Vincent Tong, Jillian Michaels, Ian James Corlett, John Novak, Paul Dobson, Michael Adamthwaite, Kelly Metzger, Brent Miller, Kirby Morrow, Brian Drummond, Mark Oliver, Michael Kopsa","Denmark, Singapore, Canada, United States","November 1, 2020",2019,TV-Y7,TV Show - Kids' TV,53,3
s1761,LEGO: CITY Adventures,Unknown Director,"Joe Zieja, Misty Lee, Alex Cazares, Daniel MK Cohen, James Arnold Taylor, Roger Craig Smith, Mick Lauer","United States, France, Denmark","November 1, 2020",2019,TV-Y,"TV Show - Kids' TV, TV Comedies",51,1
s1766,The Garfield Show,Unknown Director,"Frank Welker, Wally Wingert, Gregg Berger","France, United States","November 1, 2020",2018,TV-Y,"TV Show - Kids' TV, TV Comedies",99,4
s1767,The Good Detective,Unknown Director,"Son Hyun-joo, Jang Seung-jo, Lee Elijah, Oh Jung-se",South Korea,"November 1, 2020",2020,TV-MA,"TV Show - Crime TV Shows, International TV Shows, TV Dramas",94,0
s1770,Voice,Unknown Director,"Jang Hyuk, Lee Ha-na, Baek Sung-hyun, Ye-sung, Son Eun-seo, Kwon Jae-hwan, Lee Ju-seung, Kim Jae-wook",South Korea,"November 1, 2020",2018,TV-14,"TV Show - Crime TV Shows, International TV Shows, Korean TV Shows",89,1
s1772,Afronta! Facing It!,Juliana Vicente,"Loo Nascimento, Ingrid Silva, Rincon Sapiência, Batekoo, Gabriel Martins, Benjamin Abras, Daniele DaMata, Tasha & Tracie Okereke, Mariana de Matos, André Novais, Mahal Pita, Grace Passô, Thamyra Thâmara, Xenia França, Criola, Dani Ornellas, Anelis Assumpção, Magá Moura, Tássia Reis, Liniker, Yasmin Thayná, Raquel Virgínia, Juliana Luna, Erica Malunguinho, Diane Lima, Karol Conká",Brazil,"October 31, 2020",2017,TV-PG,"TV Show - Docuseries, International TV Shows",57,1
s1774,Zumbo's Just Desserts,Unknown Director,"Adriano Zumbo, Rachel Khoo",Australia,"October 31, 2020",2019,TV-PG,"TV Show - International TV Shows, Reality TV",99,3
s1779,Kongsuni and Friends,Unknown Director,"Hong So-yeong, Choi Bo-bae, Kim Eun-ah, Jeong Hye-won, Bae Jin-hong, Um Sang-hyun, Cha Moo-jin, Jang Min-young, Jang Do-young, Kim Sook-young, Park Ran, Kim Chang-won, Park Yeon-kyung",,"October 30, 2020",2020,TV-Y,"TV Show - Kids' TV, Korean TV Shows",65,0
s1780,Marvel's Agents of S.H.I.E.L.D.,Unknown Director,"Clark Gregg, Ming-Na Wen, Brett Dalton, Chloe Bennet, Iain De Caestecker, Elizabeth Henstridge, Adrianne Palicki, Luke Mitchell, Henry Simmons",United States,"October 30, 2020",2020,TV-14,"TV Show - TV Action & Adventure, TV Sci-Fi & Fantasy",53,0
s1782,Somebody Feed Phil,Unknown Director,Philip Rosenthal,United States,"October 30, 2020",2020,TV-14,"TV Show - Docuseries, Reality TV",84,1
s1783,Suburra: Blood on Rome,Unknown Director,"Alessandro Borghi, Giacomo Ferrara, Eduardo Valdarnini, Francesco Acquaroli, Filippo Nigro, Claudia Gerini, Adamo Dionisi, Barbara Chichiarelli, Federico Tocci, Gerasimos Skiadaresis, Elisabetta De Palo, Carlotta Antonelli, Renato Marchetti, Paola Sotgiu",Italy,"October 30, 2020",2020,TV-MA,"TV Show - Crime TV Shows, International TV Shows, TV Dramas",92,1
s1791,Blood of Zeus,Unknown Director,"Derek Phillips, Jason O'Mara, Claudia Christian, Mamie Gummer, Jessica Henwick, Elias Toufexis, Chris Diamantopoulos, Adetokumboh M'Cormack, Matthew Mercer, Melina Kanakaredes, Danny Jacobs, Matt Lowe, Adam Croasdell, Jennifer Hale, David Shaughnessy, Fred Tatasciore, Vanessa Marshall",United States,"October 27, 2020",2020,TV-MA,TV Show - Anime Series,70,1
s1792,Chico Bon Bon: Monkey with a Tool Belt,Unknown Director,"Robbie Daymond, Dayci Brookshire, Anthony Tedesco, Andy Abbott, Roberta Lemons, Cole Seaver",United States,"October 27, 2020",2020,TV-Y,TV Show - Kids' TV,49,1
s1795,The Devil Punisher,"Chang Chin-jung, Chen Rong-hui","Mike He, Ivy Shao, Anson Chen, Jane Chang, Roy Chang, Amanda Chou, Johnny Yang, Yin Chao-te, Tan Ai-Chen, Chen Bor-jeng, Dewi Chien",Taiwan,"October 26, 2020",2020,TV-14,"TV Show - International TV Shows, Romantic TV Shows, TV Mysteries",65,0
s1800,Barbarians,Unknown Director,"Laurence Rupp, Jeanne Goursaud, David Schütter, Ronald Zehrfeld, Nicki von Tempelhoff, Bernhard Schütz, Eva Verena Müller, Sophie Rois, Gaetano Aronica, Nikolai Kinski, Jeremy Miliker",Germany,"October 23, 2020",2020,TV-MA,"TV Show - International TV Shows, TV Action & Adventure, TV Dramas",73,3
s1801,Move,"Thierry Demaizière, Alban Teurlai",Unknown Cast,United States,"October 23, 2020",2020,TV-MA,"TV Show - Docuseries, International TV Shows",61,1
s1804,Stolen Away,Unknown Director,"Daniel Grao, Carolina Lapausa, Melani Olivares, Adriana Paz, Fernando Solórzano, Juan Carlos Messier, Jon Arias, Verónica Velásquez, David Trejos, Ana Maria Orozco",Spain,"October 23, 2020",2020,TV-MA,"TV Show - Crime TV Shows, International TV Shows, Spanish-Language TV Shows",57,0
s1805,The Queen's Gambit,Unknown Director,"Anya Taylor-Joy, Bill Camp, Marielle Heller, Thomas Brodie-Sangster, Moses Ingram, Harry Melling, Isla Johnston, Christiane Seidel, Rebecca Root, Chloe Pirrie, Jacob Fortune-Lloyd",United States,"October 23, 2020",2020,TV-MA,TV Show - TV Dramas,98,0
s1814,My Next Guest Needs No Introduction With David Letterman,Unknown Director,"President Barack Obama, George Clooney, Malala Yousafzai, Jay-Z, Tina Fey, Howard Stern, David Letterman",United States,"October 21, 2020",2020,TV-MA,TV Show - Stand-Up Comedy & Talk Shows,73,0
s1829,Unsolved Mysteries,Unknown Director,Unknown Cast,,"October 19, 2020",2020,TV-MA,"TV Show - Crime TV Shows, Docuseries",57,0
s1835,Start-Up,Unknown Director,"Bae Suzy, Nam Joo-hyuk, Kim Seon-ho, Kang Han-na, Kim Do-wan, Yu Su-bin, Stephanie Lee, Kim Hae-sook, Seo Yi-sook, Song Sun-mi",South Korea,"October 18, 2020",2020,TV-14,"TV Show - International TV Shows, Romantic TV Shows, TV Comedies",57,2
s1838,Grand Army,Unknown Director,"Odessa A’zion, Odley Jean, Amir Bageria, Maliq Johnson, Amalia Yoo, Alphonso Romero Jones II, Thelonius Serrell-Freed, Anthony Ippolito, Brian Altemus",United States,"October 16, 2020",2020,TV-MA,"TV Show - TV Dramas, Teen TV Shows",65,1
s1840,La Révolution,Unknown Director,"Amir El Kacem, Marilou Aussilloux, Lionel Erdogan, Isabel Aimé Gonzalez Sola, Julien Frison, Doudou Masta, Dimitri Storoge, Amélia Lacquemant, Coline Beal, Laurent Lucas, Gaia Weiss, Chiara Tantimonaco, Nina Tantimonaco, Pierre Andrau, Philippine Martinot, Jérémie Covillault",France,"October 16, 2020",2020,TV-MA,"TV Show - International TV Shows, TV Action & Adventure, TV Dramas",98,1
s1841,Someone Has to Die,Manolo Caro,"Carmen Maura, Cecilia Suárez, Ester Expósito, Ernesto Alterio, Alejandro Speitzer, Isaac Hernández, Carlos Cuevas, Mariola Fuentes, Pilar Castro, Juan Carlos Vellido, Eduardo Casanova, Manuel Morón, Javier Pereira","Mexico, Spain","October 16, 2020",2020,TV-MA,"TV Show - Crime TV Shows, International TV Shows, Spanish-Language TV Shows",55,1
s1842,The Last Kids on Earth,Unknown Director,"Nick Wolfhard, Charles Demers, Garland Whitt, Montse Hernandez, Brian Drummond, Giles Panton, Keith David",United States,"October 16, 2020",2020,TV-Y7,"TV Show - Kids' TV, TV Comedies",41,1
s1848,Fireman Sam,Unknown Director,"Steven Kynman, David Carling, Tegwen Tucker, Su Douglas, Andrew Hodwitz, Dave Pender, Lily Cassano, Carter Treneer, Sarah Lynn Strange",United Kingdom,"October 15, 2020",2018,TV-Y,"TV Show - British TV Shows, Kids' TV",57,0
s1849,Half & Half,Unknown Director,"Rachel True, Essence Atkins, Telma Hopkins, Chico Benymon, Valarie Pettiford, Alec Mapa",United States,"October 15, 2020",2005,TV-14,TV Show - TV Comedies,73,1
s1852,One on One,Unknown Director,"Flex Alexander, Kyla Pratt, Kelly Perine, Sicily Johnson, Robert Ri'chard",United States,"October 15, 2020",2006,TV-14,"TV Show - TV Comedies, Teen TV Shows",54,3
s1853,Power Rangers Beast Morphers,Unknown Director,"Rorrie D. Travis, Jazz Baduwalia, Jacqueline Scislowski, Abraham Rodríguez, Teuila Blakely, Kristina Ho, Cosme Flores, Kevin Copeland",United States,"October 15, 2020",2020,TV-Y7,TV Show - Kids' TV,51,0
s1855,Social Distance,Unknown Director,"Danielle Brooks, Oscar Nuñez, Mike Colter, Heather Burns, Okieriete Onaodowan, Ajay Naidu, Shakira Barrera, Steven Weber, Helena Howard, Daphne Rubin-Vega, Guillermo Díaz, Miguel Sandoval, Camila Perez, Gianna Aragon, Tom Costanzo, Luca Costanzo, Olli Haaskivi, Marsha Stephanie Blake, Isabella Ferreira, Rocco Luna, Larita Brooks, Misha Brooks, Liam Foley, Zoë Verbil, Anthony Norman, Brian Jordan Alvarez, Max Jenkins, Peter Vack, Rana Roy, Peter Scanavino, Ali Ahn, Tami Sagher, Barbara Rosenblat, Michael Mulheren, Leo Bai-Scanavino, Becky Ann Baker, Dylan Baker, Marcia DeBonis, Raymond Anthony Thomas, Sunita Mani, Kylie Liya Page, David Iacono, Lachlan Riley Watson, Niles Fitch, Will Meyers, Ava DeMary, Lydia Look, Asante Blackk, Ayize Ma'at, Lovie Simone",United States,"October 15, 2020",2020,TV-MA,"TV Show - TV Comedies, TV Dramas",43,0
s1861,The Cabin with Bert Kreischer,Unknown Director,"Bert Kreischer, Anthony Anderson, Caitlyn Jenner, Tom Segura, Joey Diaz, Nikki Glaser, Fortune Feimster, Bobby Lee, Donnell Rawlings, Kaley Cuoco, Joel McHale, Ms. Pat, Deon Cole, Big Jay Oakerson",United States,"October 13, 2020",2020,TV-MA,"TV Show - Reality TV, TV Comedies",72,4
s1865,Kipo and the Age of Wonderbeasts,Unknown Director,"Karen Fukuhara, Sydney Mikayla, Deon Cole, Coy Stewart, Dee Bradley Baker, Sterling K. Brown, Dan Stevens, Jake Green, Steve Blum",United States,"October 12, 2020",2020,TV-Y7,"TV Show - Kids' TV, TV Comedies",61,1
s1869,Deaf U,Unknown Director,Unknown Cast,United States,"October 9, 2020",2020,TV-MA,TV Show - Docuseries,63,1
s1874,The Haunting of Bly Manor,Unknown Director,"Victoria Pedretti, Oliver Jackson-Cohen, Henry Thomas, Amelia Eve, T'Nia Miller, Rahul Kohli, Tahirah Sharif, Amelie Bea Smith, Benjamin Evan Ainsworth",United States,"October 9, 2020",2020,TV-MA,"TV Show - TV Dramas, TV Horror, TV Mysteries",98,0
s1876,Do Do Sol Sol La La Sol,Unknown Director,"Go A-ra, Lee Jae-wook, Kim Ju-hun, Ye Ji-won, Lee Soon-jae, Shin Eun-soo, Seo Yi-sook",South Korea,"October 8, 2020",2020,TV-14,"TV Show - International TV Shows, Romantic TV Shows, TV Comedies",55,0
s1878,Private Lives,Unknown Director,"Seohyun, Ko Kyung-pyo, Kim Hyo-jin, Kim Young-min, Tae Won-seok, Song Sun-mi, Park Seong-geun, Jang Jin-hee, Yoon Sa-bong, Lee Hak-ju, Song Sang-eun, Jang Won-hyeok, Yoo Hee-je, Min Zio, Kim Min-sang, Kim Ba-da, Cha Soo-yeon",South Korea,"October 8, 2020",2020,TV-14,"TV Show - Crime TV Shows, International TV Shows, TV Dramas",98,0
s1879,The 100,Unknown Director,"Eliza Taylor, Paige Turco, Bob Morley, Marie Avgeropoulos, Christopher Larkin, Henry Ian Cusick, Isaiah Washington, Lindsey Morgan, Devon Bostick, Richard Harmon, Ricky Whittle, Jarod Joseph, Chelsey Reist, Sachin Sahel, Adina Porter","United States, Canada","October 8, 2020",2020,TV-MA,"TV Show - TV Action & Adventure, TV Dramas, TV Sci-Fi & Fantasy",71,0
s1881,To the Lake,Pavel Kostomarov,"Viktoriya Isakova, Kirill Käro, Aleksandr Robak, Natalya Zemtsova, Maryana Spivak, Yuri Kuznetsov, Eldar Kalimulin, Viktoriya Agalakova, Alexander Yatsenko, Saveliy Kudryashov",Russia,"October 7, 2020",2020,TV-MA,"TV Show - International TV Shows, TV Dramas, TV Mysteries",72,1
s1886,Bad Boy Billionaires: India,Unknown Director,Unknown Cast,India,"October 5, 2020",2020,TV-14,"TV Show - British TV Shows, Docuseries, International TV Shows",96,0
s1890,Pat a Pat Como,Unknown Director,Unknown Cast,,"October 3, 2020",2016,TV-Y,TV Show - Kids' TV,64,0
s1891,Qurious Como,Unknown Director,Unknown Cast,,"October 3, 2020",2017,TV-Y,TV Show - Kids' TV,65,4
s1894,DreamWorks Happy Holidays from Madagascar,Unknown Director,"Tom McGrath, Chris Miller, Christopher Knights, John DiMaggio, Ben Stiller, Chris Rock, David Schwimmer, Jada Pinkett Smith, Cedric the Entertainer, Andy Richter, Carl Reiner",United States,"October 2, 2020",2005,TV-PG,"TV Show - Kids' TV, TV Comedies",81,1
s1895,Emily in Paris,Unknown Director,"Lily Collins, Philippine Leroy-Beaulieu, Ashley Park, Lucas Bravo, Kate Walsh, Samuel Arnold, Bruno Gouery, Camille Razat",United States,"October 2, 2020",2020,TV-MA,"TV Show - Romantic TV Shows, TV Comedies, TV Dramas",95,1
s1896,H2O: Just Add Water,Unknown Director,"Cariba Heine, Phoebe Tonkin, Angus McLaren, Burgess Abernethy, Claire Holt, Alan David Lee, Cleo Massey, Jamie Timony",Australia,"October 2, 2020",2009,TV-PG,"TV Show - Kids' TV, TV Dramas",72,1
s1907,Evil,Unknown Director,"Katja Herbers, Mike Colter, Aasif Mandvi, Michael Emerson, Christine Lahti, Kurt Fuller, Marti Matulis",United States,"October 1, 2020",2019,TV-14,TV Show - TV Dramas,73,4
s1908,Familiar Wife,Unknown Director,"Ji Sung, Han Ji-min, Kang Han-na, Jang Seung-jo",South Korea,"October 1, 2020",2018,TV-MA,"TV Show - International TV Shows, Romantic TV Shows, TV Dramas",57,1
s1909,Food Wars!: Shokugeki no Soma,Unknown Director,"Yoshitsugu Matsuoka, Risa Taneda, Minami Takahashi, Shizuka Ishigami, Natsuki Hanae, Yuki Ono, Takahiro Sakurai, Ai Kayano, Maaya Uchida, Taishi Murata, Yusuke Kobayashi, Saori Onishi, Hisako Kanemoto, Chinatsu Akasaki, Nobuhiko Okamoto, Junichi Suwabe, Yuichi Nakamura, Jun Fukuyama",Japan,"October 1, 2020",2016,TV-MA,"TV Show - Anime Series, International TV Shows, Teen TV Shows",50,1
s1911,"Good Morning, Verônica",Unknown Director,"Tainá Müller, Eduardo Moscovis, Camila Morgado, Antonio Grassi, Elisa Volpatto, César Mello, Sílvio Guindane, Alice Valverde, DJ Amorim, Adriano Garib, Johnnas Oliva, Marina Provenzzano, José Rubens Chachá, Julia Ianina, Sacha Bali, Aline Borges, Cassio Pandolfi, Pally Siqueira, Juliana Lohmann",Brazil,"October 1, 2020",2020,TV-MA,"TV Show - Crime TV Shows, International TV Shows, TV Mysteries",53,1
s1915,Journey of an African Colony,Unknown Director,Olasupo Shasore,,"October 1, 2020",2018,TV-MA,"TV Show - Docuseries, International TV Shows",66,1
s1916,Oktoberfest: Beer & Blood,Unknown Director,"Mišel Matičević, Martina Gedeck, Klaus Steinbacher, Mercedes Müller, Maximilian Brückner, Brigitte Hobmeier, Markus Krojer, Martin Feifel, Michael Kranz, Vladimir Burlakov","Germany, Czech Republic","October 1, 2020",2020,TV-MA,"TV Show - International TV Shows, TV Dramas",99,1
s1918,Secreto bien guardado,Unknown Director,"Oriana Sabatini, Victorio D'Alessandro, Noemí Frenkel, Matías Mayer, Paula Sartor, Agustina Palma, Graciela Tenenbaum, Bárbara Lombardo",Argentina,"October 1, 2020",2019,TV-MA,"TV Show - International TV Shows, Romantic TV Shows, Spanish-Language TV Shows",60,1
s1919,Sword Art Online,Unknown Director,"Yoshitsugu Matsuoka, Haruka Tomatsu, Ayana Taketatsu, Kanae Ito, Rina Hidaka, Ayahi Takagaki, Hiroaki Hirata, Hiroki Yasumoto, Saori Hayami, Koichi Yamadera",Japan,"October 1, 2020",2018,TV-MA,"TV Show - Anime Series, International TV Shows",98,1
s1923,The Parkers,Unknown Director,"Mo'Nique, Countess Vaughn, Dorien Wilson, Jenna von Oÿ, Ken Lawson, Yvette Wilson",United States,"October 1, 2020",2003,TV-PG,TV Show - TV Comedies,78,1
s1924,The Unicorn,Unknown Director,"Walton Goggins, Rob Corddry, Michaela Watkins, Omar Benson Miller, Maya Lynne Robinson, Ruby Jay, Makenzie Moss",United States,"October 1, 2020",2019,TV-14,"TV Show - TV Comedies, TV Dramas",86,1
s1926,You Cannot Hide,Unknown Director,"Blanca Soto, Eduardo Noriega, Iván Sánchez, Maribel Verdú, Samantha Siqueiros, Peter Vives, Patricia Guirado, Jorge Bosch, Pere Ponce, Juan Caballero, Jordi Planas",Mexico,"October 1, 2020",2020,TV-MA,"TV Show - Crime TV Shows, International TV Shows, Spanish-Language TV Shows",99,4
s1929,Black Butler,Unknown Director,"Daisuke Ono, Maaya Sakamoto, Hiroki Touchi, Yuki Kaji, Emiri Kato, Koji Yusa, Shunji Fujimura, Yukari Tamura, Romi Park, Jun Fukuyama",Japan,"September 30, 2020",2010,TV-MA,"TV Show - Anime Series, International TV Shows",97,4
s1930,Man with a Plan,Unknown Director,"Matt LeBlanc, Liza Snyder, Grace Kaufman, Matthew McCann, Hala Finley, Matt Cook, Jessica Chaffin",United States,"September 30, 2020",2020,TV-PG,TV Show - TV Comedies,51,4
s1934,Wentworth,Unknown Director,"Danielle Cormack, Nicole da Silva, Kate Atkinson, Celia Ireland, Shareena Clanton, Aaron Jeffery, Robbie Magasiva, Katrina Milosevic, Jacqueline Brennan, Ra Chapman, Pamela Rabe, Sigrid Thornton, Socratis Otto, Bernard Curry, Tammy MacIntosh, Kate Jenkinson",Australia,"September 30, 2020",2020,TV-MA,"TV Show - Crime TV Shows, TV Dramas",97,1
s1948,"Whose Vote Counts, Explained",Unknown Director,Unknown Cast,United States,"September 28, 2020",2020,TV-PG,TV Show - Docuseries,56,1
s1949,Van Helsing,Unknown Director,"Kelly Overton, Jonathan Scarfe, Christopher Heyerdahl, Paul Johansson, David Cubitt, Tim Guinee",United States,"September 27, 2020",2019,TV-MA,"TV Show - International TV Shows, TV Action & Adventure, TV Dramas",46,1
s1950,The Good Place,Unknown Director,"Kristen Bell, Ted Danson, William Jackson Harper, Jameela Jamil, D'Arcy Carden, Manny Jacinto",United States,"September 26, 2020",2020,TV-14,TV Show - TV Comedies,68,1
s1952,A Perfect Crime,Unknown Director,Unknown Cast,Germany,"September 25, 2020",2020,TV-14,"TV Show - Crime TV Shows, Docuseries, International TV Shows",84,1
s1953,Mighty Little Bheem,Unknown Director,Unknown Cast,,"September 25, 2020",2020,TV-Y,"TV Show - Kids' TV, TV Comedies",62,1
s1955,Sneakerheads,Unknown Director,"Allen Maldonado, Andrew Bachelor, Jearnest Corchado, Matthew Josten, Yaani King Mondschein, Justin Lee, Aja Evans",United States,"September 25, 2020",2020,TV-MA,TV Show - TV Comedies,89,1
s1956,The School Nurse Files,Unknown Director,"Jung Yu-mi, Nam Joo-hyuk",South Korea,"September 25, 2020",2020,TV-MA,"TV Show - International TV Shows, TV Dramas, TV Mysteries",57,1
s1959,The Chef Show,Unknown Director,"Jon Favreau, Roy Choi",United States,"September 24, 2020",2020,TV-MA,TV Show - Docuseries,42,1
s1962,The Playbook,Unknown Director,Unknown Cast,United States,"September 22, 2020",2020,TV-MA,TV Show - Docuseries,61,1
s1974,Fukrey Boyzzz,Unknown Director,"Viraaj Modgill, Jasleen Singh, Pooja Punjabi, Viswanathan Sridhar, Manish Bhavan, Suvela Sharma, Surabhi Pandey, Zeel Thakkar",,"September 19, 2020",2020,TV-Y,"TV Show - Kids' TV, TV Comedies",69,0
s1979,Ratched,Unknown Director,"Sarah Paulson, Finn Wittrock, Judy Davis, Sharon Stone, Cynthia Nixon, Jon Jon Briones, Charlie Carver",United States,"September 18, 2020",2020,TV-MA,"TV Show - TV Dramas, TV Horror, TV Mysteries",60,1
s1980,The American Barbecue Showdown,Unknown Director,"Lyric Lewis, Rutledge Wood",United States,"September 18, 2020",2020,TV-G,TV Show - Reality TV,61,3
s1981,The Blacklist,Unknown Director,"James Spader, Megan Boone, Diego Klattenhoff, Ryan Eggold, Harry Lennix, Amir Arison, Hisham Tawfiq, Mozhan Marnò",United States,"September 18, 2020",2019,TV-14,"TV Show - Crime TV Shows, TV Dramas, TV Thrillers",91,1
s1984,Dragon's Dogma,Unknown Director,"Greg Chun, Erica Mendez, Cristina Vee, David Lodge, Yuichi Nakamura, Nana Mizuki, Miyuki Sawashiro, Yuko Sanpei, Suzuko Mimori, Takayuki Sugo",,"September 17, 2020",2020,TV-MA,"TV Show - Anime Series, International TV Shows",95,4
s1989,The Last Word,Unknown Director,"Anke Engelke, Thorsten Merten, Nina Gummich, Johannes Zeiler, Juri Winkler, Gudrun Ritter, Aaron Hilmer, Claudia Geisler-Bading",Germany,"September 17, 2020",2020,TV-MA,"TV Show - International TV Shows, TV Comedies, TV Dramas",75,0
s1990,Baby,Unknown Director,"Benedetta Porcaroli, Alice Pagani, Riccardo Mandolini, Chabeli Sastre Gonzalez, Brando Pacitto, Lorenzo Zurzolo, Claudia Pandolfi, Galatea Ranzi",Italy,"September 16, 2020",2020,TV-MA,"TV Show - International TV Shows, TV Dramas, Teen TV Shows",41,4
s1991,Challenger,Unknown Director,Unknown Cast,United States,"September 16, 2020",2020,TV-14,"TV Show - Docuseries, Science & Nature TV",50,4
s1992,Criminal: UK,Unknown Director,"Katherine Kelly, Lee Ingleby, Mark Stanley, Rochenda Sandall, Shubham Saraf, Nicholas Pinnock, David Tennant, Hayley Atwell, Youssef Kerkour, Clare-Hope Ashitey, Isabella Laughland","United Kingdom, France, Germany, Spain","September 16, 2020",2020,TV-MA,"TV Show - British TV Shows, Crime TV Shows, International TV Shows",83,1
s1994,Signs,Unknown Director,"Andrzej Konopka, Helena Sujecka, Piotr Trojan, Michał Czernecki, Mariusz Ostrowski, Robert Gulaczyk, Mirosław Kropielnicki, Helena Englert, Paulina Gałązka, Magdalena Źak",Poland,"September 16, 2020",2020,TV-MA,"TV Show - Crime TV Shows, International TV Shows, TV Dramas",68,1
s1995,Sing On!,Unknown Director,Tituss Burgess,United States,"September 16, 2020",2020,TV-PG,TV Show - Reality TV,42,0
s1999,Call the Midwife,Philippa Lowthorpe,"Vanessa Redgrave, Bryony Hannah, Helen George, Jenny Agutter, Pam Ferris, Laura Main, Judy Parfitt, Cliff Parisi, Stephen McGann, Ben Caplan, Miranda Hart, Jessica Raine, Max Macmillan, Victoria Yeates, Jack Ashton, Emerald Fennell, Linda Bassett",United Kingdom,"September 15, 2020",2020,TV-MA,"TV Show - British TV Shows, International TV Shows, TV Dramas",55,0
s2003,Taco Chronicles,Unknown Director,Unknown Cast,United States,"September 15, 2020",2020,TV-MA,"TV Show - Docuseries, International TV Shows, Reality TV",89,0
s2007,Buddi,Unknown Director,"Greta Jameson, Ralf Jameson, Clementine Laikin, Felix Laikin","United Kingdom, China","September 11, 2020",2020,TV-Y,"TV Show - British TV Shows, Kids' TV",47,1
s2009,Family Business,Unknown Director,"Jonathan Cohen, Gérard Darmon, Julia Piaton, Liliane Rovère, Olivier Rosemberg, Ali Marhyar, Lina El Arabi, Louise Coldefy, Enrico Macias, Valérie Damidot",France,"September 11, 2020",2020,TV-MA,"TV Show - International TV Shows, TV Comedies, TV Dramas",87,1
s2010,Girlfriends,Unknown Director,"Tracee Ellis Ross, Golden Brooks, Persia White, Jill Marie Jones, Reginald C. Hayes",United States,"September 11, 2020",2007,TV-14,TV Show - TV Comedies,50,0
s2013,The Barrier,Unknown Director,"Unax Ugalde, Olivia Molina, Eleonora Wexler, Abel Folk, Ángela Molina, Manu Fullola, Daniel Ibáñez, Laura Quirós, Nicolás Illoro, Belén Écija, Juan Blanco, Yaima Ramos",Spain,"September 11, 2020",2020,TV-MA,"TV Show - International TV Shows, Spanish-Language TV Shows, TV Dramas",100,1
s2014,The Duchess,Unknown Director,"Katherine Ryan, Rory Keenan, Katy Byrne, Doon Mackichan, Steen Raskopoulos, Michelle de Swarte, Sophie Fletcher",United Kingdom,"September 11, 2020",2020,TV-MA,"TV Show - British TV Shows, International TV Shows, TV Comedies",61,1
s2022,Greenleaf,Unknown Director,"Merle Dandridge, Kim Hawthorne, Desiree Ross, Lamman Rucker, Tye White, Lynn Whitfield, Deborah Joy Winans, Keith David, Lovie Simone, Gregory Alan Williams, Oprah Winfrey",United States,"September 10, 2020",2020,TV-14,TV Show - TV Dramas,95,3
s2023,Julie and the Phantoms,Kenny Ortega,"Madison Reyes, Charlie Gillespie, Owen Patrick Joyner, Jeremy Shada, Jadah Marie, Sacha Carlson, Savannah Lee May, Cheyenne Jackson, Carlos Ponce, Booboo Stewart, Sonny Bustamante",United States,"September 10, 2020",2020,TV-G,"TV Show - Kids' TV, TV Comedies",67,0
s2033,Get Organized with The Home Edit,Unknown Director,Unknown Cast,United States,"September 9, 2020",2020,TV-PG,TV Show - Reality TV,51,1
s2034,La Línea: Shadow of Narco,Pepe Mora,Unknown Cast,Spain,"September 9, 2020",2020,TV-MA,"TV Show - Crime TV Shows, Docuseries, International TV Shows",55,0
s2038,Record of Youth,Unknown Director,"Park Bo-gum, Park So-dam, Byeon Woo-seok, Ha Hee-ra, Shin Ae-ra, Han Jin-hee, Shin Dong-mi, Lee Chang-hoon, Kwon Soo-hyun, Cho Yu-jung, Park Su-young, Seo Sang-won, Lee Jae-won",South Korea,"September 8, 2020",2020,TV-14,"TV Show - International TV Shows, Romantic TV Shows, TV Dramas",93,0
s2041,Transformers: Cyberverse,Unknown Director,"Sophia Isabella, Jeremy Levy, Jacob Tillman, Ryan Andes, Deanna McGovern, Dick Terhune",,"September 7, 2020",2020,TV-Y7,TV Show - Kids' TV,58,1
s2043,Cleverman,Unknown Director,"Hunter Page-Lochard, Rob Collins, Deborah Mailman, Ryan Corr, Stef Dawson, Iain Glen, Frances O'Connor, Tasma Walton, Tony Briggs","Australia, New Zealand, United States","September 5, 2020",2017,TV-MA,"TV Show - TV Dramas, TV Sci-Fi & Fantasy, TV Thrillers",85,1
s2045,Away,Unknown Director,"Hilary Swank, Josh Charles, Vivian Wu, Mark Ivanir, Ato Essandoh, Ray Panthaki, Talitha Eliana Bateman",United States,"September 4, 2020",2020,TV-14,"TV Show - Romantic TV Shows, TV Dramas, TV Sci-Fi & Fantasy",52,0
s2048,Spirit Riding Free: Riding Academy,Unknown Director,"Amber Frank, Bailey Gambertoglio, Sydney Park, Darcy Rose Byrnes, Rhys Darby",United States,"September 4, 2020",2020,TV-Y7,TV Show - Kids' TV,82,1
