show_id,title,director,cast,country,date_added,release_year,rating,content_category,preferences,Cluster
s5655,AJIN: Demi-Human,Unknown Director,"Mamoru Miyano, Yoshimasa Hosoya, Jun Fukuyama, Hochu Otsuka, Daisuke Hirakawa, Takahiro Sakurai, Mikako Komatsu, Hiroyuki Kinoshita, Aya Suzaki",Japan,"December 27, 2016",2016,TV-MA,"TV Show - Anime Series, International TV Shows",92,2
s5656,Chasing Cameron,Unknown Director,"Cameron Dallas, Aaron Carpenter, Taylor Caniff, Willie Jones, Trey Schafer, Bart Bordelon, Blake Gray",United States,"December 27, 2016",2016,TV-14,"TV Show - Reality TV, Teen TV Shows",44,4
s5659,Sense8,Unknown Director,"Tuppence Middleton, Brian J. Smith, Doona Bae, Max Riemelt, Naveen Andrews, Daryl Hannah, Freema Agyeman, Terrence Mann, Adam Shapiro, Max Mauff, Alfonso Herrera, Eréndira Ibarra, Aml Ameen, Jamie Clayton, Tina Desae, Miguel Ángel Silvestre, Toby Onwumere, Joe Pantoliano",United States,"December 23, 2016",2018,TV-MA,"TV Show - Crime TV Shows, TV Dramas, TV Mysteries",97,1
s5663,Crazyhead,Unknown Director,"Cara Theobold, Susan Wokoma, Riann Steele, Arinzé Kene, Lewis Reeves, Tony Curran",United Kingdom,"December 16, 2016",2016,TV-MA,"TV Show - British TV Shows, International TV Shows, TV Comedies",54,4
s5666,Color of Woman,Unknown Director,"Jae Hee, Soo-kyung Lee, So-yi Yoon, Ji-ho Shim, Sang-Myeon Park, Joo-young Kim",South Korea,"December 15, 2016",2012,TV-PG,"TV Show - International TV Shows, Korean TV Shows, Romantic TV Shows",70,1
s5668,Goodbye My Wife,Unknown Director,"Soo-hyun Hong, Si Won Ryu, Ji-yoon Park, Min-soo Kim, Julien Kang, Joo-eun Oh, Seong-mo Jeong",South Korea,"December 15, 2016",2012,TV-14,"TV Show - International TV Shows, Korean TV Shows, Romantic TV Shows",85,1
s5669,Happy And,Unknown Director,"Hee-Jin Lee, Hae-seong Kwon, Paul Stafford, Mi-ji Lee, Ik-tae Kim, Ki-hyeon Kim",South Korea,"December 15, 2016",2012,TV-14,"TV Show - International TV Shows, Korean TV Shows, TV Dramas",80,2
s5670,Heaven's Garden,Unknown Director,"Bul-am Choi, Ho-Jeong Yoo, Sae-ron Kim, Chan-hee Kang, Woo-Sung Hyun, An Seo Hyun, Ho-Jin Kim",South Korea,"December 15, 2016",2011,TV-MA,"TV Show - International TV Shows, Korean TV Shows, TV Dramas",65,2
s5671,Ice Fantasy,Unknown Director,"Feng Shaofeng, Victoria Song, Ma Tianyu, Zhang Meng, Hee-seon Kim, Gong Beibi, Shao Bing, Hu Bing, Wang Duo",China,"December 15, 2016",2016,TV-14,"TV Show - International TV Shows, TV Action & Adventure, TV Sci-Fi & Fantasy",61,1
s5672,Immortal Classic,Unknown Director,"Jae-suk Han, Sun-Young Park, Du-shim Ko, Ye-jin Lim, Jong-hwan Choi, Ha-Nui Lee, Yun-Hoo Ko, Byeong-Ki Kim, Sun-kyung Kim, Yoon-Sik Baek",South Korea,"December 15, 2016",2012,TV-14,"TV Show - International TV Shows, Korean TV Shows, TV Dramas",66,1
s5673,InuYasha,Unknown Director,"Kappei Yamaguchi, Satsuki Yukino, Kumiko Watanabe, Noriko Hidaka, Koji Tsujitani, Houko Kuwashima, Toshiyuki Morikawa, Richard Ian Cox, Moneca Stori, Paul Dobson, Kirby Morrow, Kelly Sheridan, Jillian Michaels",Japan,"December 15, 2016",2001,TV-14,"TV Show - Anime Series, International TV Shows",50,1
s5674,K-POP Extreme Survival,Unknown Director,"Jung Eun Kim, Yu-hwan Park, Eun-ah Go, Yong Hwan Kwak, Jin Hyuk",South Korea,"December 15, 2016",2012,TV-14,"TV Show - International TV Shows, Korean TV Shows, Romantic TV Shows",44,0
s5675,Merlin,James Hawes,"Colin Morgan, Bradley James, Katie McGrath, Angel Coulby, Richard Wilson, Anthony Head, John Hurt, Nathaniel Parker",United Kingdom,"December 15, 2016",2012,TV-PG,"TV Show - British TV Shows, International TV Shows, TV Action & Adventure",49,0
s5676,Miss Panda & Mr. Hedgehog,Unknown Director,"Dong-hae Lee, Seung-ah Yoon, Jin-hyuk Choi, So-young Yoo, Yeo-jin Hong, Min-jin Jung",South Korea,"December 15, 2016",2012,TV-PG,"TV Show - International TV Shows, Korean TV Shows, Romantic TV Shows",82,0
s5678,Tokyo Trial,Unknown Director,"Marcel Hensema, Paul Freeman, Irrfan Khan, Stacy Keach, Michael Ironside, Stephen McHattie, Shinya Tsukamoto","Canada, Japan, Netherlands","December 13, 2016",2017,TV-MA,"TV Show - International TV Shows, TV Dramas",85,0
s5681,Captive,Unknown Director,Unknown Cast,United Kingdom,"December 9, 2016",2016,TV-MA,"TV Show - Crime TV Shows, Docuseries",95,0
s5684,White Rabbit Project,Unknown Director,"Tory Belleci, Kari Byron, Grant Imahara",United States,"December 9, 2016",2016,TV-14,"TV Show - Docuseries, International TV Shows, Reality TV",41,4
s5685,Miss in Kiss,Unknown Director,"Esther Wu, Dino Lee, Gong Yi Teng, Xi Wei Lun, Honduras, Vega Tsai, Shen Chang Hung",Taiwan,"December 8, 2016",2016,TV-14,"TV Show - International TV Shows, Romantic TV Shows, TV Comedies",78,1
s5687,The Cuba Libre Story,Unknown Director,Unknown Cast,"France, Germany","December 8, 2016",2015,TV-14,"TV Show - Docuseries, International TV Shows",83,1
s5691,From Dusk Till Dawn,Unknown Director,"D.J. Cotrona, Zane Holtz, Eiza Gonzalez, Jesse Garcia, Madison Davenport, Brandon Soo Hoo, Wilmer Valderrama, Robert Patrick, Jake Busey, Samantha Esteban, Don Johnson",United States,"December 5, 2016",2016,TV-MA,"TV Show - Classic & Cult TV, TV Action & Adventure, TV Horror",76,0
s5693,Lost & Found Music Studios,Unknown Director,"Victoria Baldesarra, Sarah Carmosino, Jordan Clark, DeShaun Clarke, Keara Graves, Katrina Hachey, Shane Harte, Ali Milner, Levi Randall, Brittany Raymond, Trevor Tordjman, Michael Torontow, Alex Zaichkowski, Matthew Bacik, Alyssa Baker, Ella Jonas Farlinger, Ian Matthews, Rakim Kelly, Bailey Pelkman, Olivia Solo",Canada,"December 3, 2016",2016,TV-G,"TV Show - Kids' TV, TV Comedies, TV Dramas",72,0
s5700,Back to 1989,Unknown Director,"Marcus Chang, Ivy Shao, Mini Tsai, Yorke Sun, Ray Yang, Chang Chieh",Taiwan,"December 1, 2016",2016,TV-PG,"TV Show - International TV Shows, Romantic TV Shows, TV Comedies",84,0
s5701,Bromance,Unknown Director,"Baron Chen, Megan Lai, Bii, Katie Chen, Sean Lee",Taiwan,"December 1, 2016",2015,TV-PG,"TV Show - International TV Shows, Romantic TV Shows, TV Comedies",84,0
s5704,Refresh Man,Unknown Director,"Aaron Yan, Joanne Tseng, Lene Lai, Jack Lee, JR",Taiwan,"December 1, 2016",2016,TV-14,"TV Show - International TV Shows, Romantic TV Shows, TV Comedies",62,2
s5708,Gilmore Girls: A Year in the Life,Unknown Director,"Lauren Graham, Alexis Bledel, Kelly Bishop, Scott Patterson, Yanic Truesdale, Matt Czuchry, Liza Weil, Milo Ventimiglia, Sean Gunn, Keiko Agena, Rose Abdoo, Melissa McCarthy",United States,"November 25, 2016",2016,TV-14,"TV Show - TV Comedies, TV Dramas, Teen TV Shows",89,0
s5716,La Niña,Unknown Director,"Ana María Estupiñán, Sebastian Eslava, Juan Sebastián Aragón, Diego Vásquez, Carlos Velazquez, Marcela Benjumea, Melisa Caceres, Michelle Orozco, Alberto Cardeño, Constanza Camelo, Fernando Arévalo",Colombia,"November 18, 2016",2016,TV-MA,"TV Show - Crime TV Shows, International TV Shows, Spanish-Language TV Shows",63,0
s5717,Paranoid,Unknown Director,"Indira Varma, Robert Glenister, Dino Fetscher, Neil Stuke, Christiane Paul, Lesley Sharp, Kevin Doyle",United Kingdom,"November 17, 2016",2016,TV-MA,"TV Show - British TV Shows, Crime TV Shows, International TV Shows",97,0
s5721,Einsatzgruppen: The Nazi Death Squads,Unknown Director,Paul Bandey,France,"November 10, 2016",2009,TV-MA,"TV Show - Docuseries, International TV Shows",95,0
s5723,Case,Unknown Director,"Steinunn Ólína Þorsteinsdóttir, Magnús Jónsson, Þorsteinn Bachmann, Jóhanna Vigdís Arnardóttir, Birna Rún Eiríksdóttir, Elma Stefania Agustsdottir, Bergur Þór Ingólfsson, Halldóra Geirharðsdóttir, Arnar Jónsson, Davíð Freyr Þórunnarson, Björn Stefánsson, Nína Dögg Filippusdóttir, Hjortur Jóhann Jónsson",Iceland,"November 9, 2016",2015,TV-MA,"TV Show - Crime TV Shows, International TV Shows, TV Dramas",95,1
s5724,Danger Mouse,Unknown Director,"Alexander Armstrong, Kevin Eldon, Stephen Fry, Ed Gaughan, Shauna Macdonald, Dave Lamb, Morwenna Banks",United Kingdom,"November 9, 2016",2016,TV-Y7,"TV Show - British TV Shows, Kids' TV",90,1
s5728,Inborn Pair,Unknown Director,"Annie Chen, Chris Wang, Hsieh Kun Da, Puff Kuo, Jennifer Hong",Taiwan,"November 1, 2016",2011,TV-14,"TV Show - International TV Shows, Romantic TV Shows, TV Comedies",56,4
s5729,Just You,Unknown Director,"Aaron Yan, Puff Kuo, Katherine Wang, Dean Fujioka, Lyla Lin, Lin Yu-pin",Taiwan,"November 1, 2016",2013,TV-14,"TV Show - International TV Shows, Romantic TV Shows, TV Comedies",80,3
s5730,Love Around,Unknown Director,"George Hu, Annie Chen, Mandy Tao, Jack Lee, Tan Ai-Chen, Jian Chang, Wang Chuan",Taiwan,"November 1, 2016",2013,TV-14,"TV Show - International TV Shows, Romantic TV Shows, TV Comedies",73,0
s5731,Love Family,Unknown Director,"Chris Wang, Serena Fang, Jack Lee, Amanda Chou, Yin Fu, Rabbit Yang, Meng-sheng Shen",Taiwan,"November 1, 2016",2013,TV-MA,"TV Show - International TV Shows, Romantic TV Shows, TV Comedies",44,1
s5732,Love Me or Leave Me,Unknown Director,"Ann Hsu, Chris Wang, Alan Kuo, K'ang-i Lee, Albee Huang",Taiwan,"November 1, 2016",2012,TV-14,"TV Show - International TV Shows, Romantic TV Shows, TV Comedies",72,4
s5733,Love Now,Unknown Director,"Annie Chen, George Hu, Bobby Dou, Vivi Lee, Harry Chang, Esther Yang, Mandy Wei",Taiwan,"November 1, 2016",2012,TV-14,"TV Show - International TV Shows, Romantic TV Shows, TV Comedies",79,0
s5742,Trailer Park Boys: Out of the Park: Europe,Unknown Director,"Mike Smith, John Paul Tremblay, Robb Wells",Canada,"October 28, 2016",2016,TV-MA,"TV Show - International TV Shows, TV Comedies",66,1
s5745,Containment,Unknown Director,"David Gyasi, Christina Marie Moses, Chris Wood, Kristen Gutoskie, Claudia Black, George Young, Hanna Mangan Lawrence, Trevor St. John",United States,"October 21, 2016",2016,TV-MA,"TV Show - TV Dramas, TV Thrillers",41,3
s5752,DEATH NOTE,Unknown Director,"Kappei Yamaguchi, Alessandro Juliani, Mamoru Miyano, Brad Swaile, Ai Satou, Saffron Henderson, Akeno Watanabe, Lisa Ann Beley, Aya Hirano, Shannon Chan-Kent, Haruka Kudo, Kelly Metzger, Hideo Ishikawa, Brian Dobson, Hiroki Takahashi, Sam Vincent, Shido Nakamura, Brian Drummond, Naoya Uchida, Chris Britton",Japan,"October 15, 2016",2006,TV-14,"TV Show - Anime Series, Crime TV Shows, International TV Shows",75,1
s5753,Spotless,Unknown Director,"Marc-André Grondin, Denis Ménochet, Miranda Raison, Doug Allen, Liam Garrigan, Ciarán Owens, Kate Magowan, Tanya Fear, Naomi Radcliffe, Lucy Akhurst, Jemma Donovan, Niall Hayes, Brendan Coyle","United Kingdom, France","October 15, 2016",2015,TV-MA,"TV Show - Crime TV Shows, International TV Shows, TV Dramas",91,3
s5754,Vampire Knight,Unknown Director,"Daisuke Kishio, Ezra Weisz, Mamoru Miyano, Vic Mignogna, Yui Horie, Mela Lee, Risa Mizuno, Stephanie Sheh, Junichi Suwabe, Troy Baker, Jun Fukuyama, Bryce Papenbrook, Mai Nakahara, Laura Bailey, Soichiro Hoshi, Steve Staley, Susumu Chiba, Spike Spencer, Hiroki Yasumoto, Travis Willingham, Fumiko Orikasa, Wendee Lee",Japan,"October 15, 2016",2008,TV-14,"TV Show - Anime Series, International TV Shows, Romantic TV Shows",97,1
s5760,StoryBots Super Songs,Unknown Director,"Judy Greer, Jeff Gill, Erin Fitzgerald, Fred Tatasciore, Gregg Spiridellis",United States,"October 7, 2016",2016,TV-Y,TV Show - Kids' TV,50,0
s5763,Be with Me,Unknown Director,"Jason Tsou, Queen Wei, River Huang, Fabien Yang, Tang Chen-Kang, Figaro Tseng",Taiwan,"October 1, 2016",2015,TV-PG,"TV Show - International TV Shows, Romantic TV Shows, TV Dramas",42,0
s5764,Be with You,Unknown Director,"Bobby Dou, Peijia Huang, Nylon Chen, Vivi Lee, Edison Wang, Serena Fang",Taiwan,"October 1, 2016",2015,TV-14,"TV Show - International TV Shows, Romantic TV Shows, TV Dramas",83,1
s5767,Fall in Love with Me,Unknown Director,"Aaron Yan, Tia Lee, Jack Lee, Katherine Wang, Beatrice Fang, Vince Kao, Chen Bor Jeng",Taiwan,"October 1, 2016",2014,TV-14,"TV Show - International TV Shows, Romantic TV Shows, TV Comedies",47,0
s5769,Love Cheque Charge,Unknown Director,"George Hu, Phoebe Yuan, Hsieh Kun Da, Jay Shih, Smile Weng, Jet Chao, Jessie Chang",Taiwan,"October 1, 2016",2014,TV-14,"TV Show - International TV Shows, Romantic TV Shows, TV Comedies",48,0
s5770,Masha's Spooky Stories,Unknown Director,Unknown Cast,"United States, Russia","October 1, 2016",2012,TV-Y,TV Show - Kids' TV,46,1
s5772,Murphy's Law of Love,Unknown Director,"Danson Tang, Chia-ying Lee, Jolin Chien, Jenna Wang, Meng-sheng Shen, Wen-lin Fang, Wei Lin, Phoebe Huang",Taiwan,"October 1, 2016",2015,TV-PG,"TV Show - International TV Shows, Romantic TV Shows, TV Comedies",43,0
s5775,Old Money,David Schalko,"Udo Kier, Sunnyi Melles, Nicholas Ofczarek, Manuel Rubey, Nora von Waldstätten, Thomas Stipsits, Ursula Strauss, Robert Palfrader, Simon Schwarz, Johannes Krisch, Lukas Miko",United States,"October 1, 2016",2015,TV-MA,"TV Show - International TV Shows, TV Comedies, TV Dramas",87,0
s5778,Someone Like You,Unknown Director,"Kingone Wang, Lorene Ren, Sean Lee, Nita Lei, William Liao",Taiwan,"October 1, 2016",2015,TV-14,"TV Show - International TV Shows, Romantic TV Shows, TV Dramas",96,1
s5782,When I See You Again,Unknown Director,"Jasper Liu, Mandy Wei, Jet Chao, Ivy Shao, Tina Chou, Kao Meng-Chieh",Taiwan,"October 1, 2016",2015,TV-14,"TV Show - International TV Shows, Romantic TV Shows, TV Comedies",76,1
s5786,VeggieTales in the House,Unknown Director,"Phil Vischer, Mike Nawrocki, Rob Paulsen, Tress MacNeille",United States,"September 23, 2016",2016,TV-Y,TV Show - Kids' TV,50,0
s5800,Chef's Table: France,Unknown Director,Unknown Cast,,"September 2, 2016",2016,TV-14,TV Show - Docuseries,98,2
s5801,Kulipari: An Army of Frogs,Unknown Director,"Mark Hamill, Keith David, Wendie Malick, Josh Keaton, Mikey Kelley, Phil LaMarr, Laraine Newman, Jess Harnell, Charles Adler, Amy Margolis, Cree Summer, Lacey Chabert, Rolonda Watts, Kevin Michael Richardson, Candi Milo",United States,"September 2, 2016",2016,TV-Y7,TV Show - Kids' TV,75,4
s5802,Conspiracy,Unknown Director,Mark Bazeley,United Kingdom,"September 1, 2016",2015,TV-14,"TV Show - British TV Shows, Docuseries",84,4
s5803,Dead Set,Unknown Director,"Jaime Winstone, Andy Nyman, Kevin Eldon, Davina McCall, Warren Brown, Riz Ahmed, Beth Cordingly, Kathleen McDermott, Raj Ghatak",United Kingdom,"September 1, 2016",2008,TV-MA,"TV Show - British TV Shows, TV Horror, TV Thrillers",63,4
s5804,Forensic Files,Unknown Director,Peter Thomas,United States,"September 1, 2016",2011,TV-MA,"TV Show - Crime TV Shows, Docuseries, Science & Nature TV",73,0
s5806,The Fierce Wife,Unknown Director,"Sonia Sui, James Wen, Amanda Chu, Chris Wang, Karen Ying-Chen Hu, Patrick Lee, Janel Tsai, Li-li Pan, Fu Lei",Taiwan,"September 1, 2016",2010,TV-MA,"TV Show - International TV Shows, Romantic TV Shows, TV Dramas",49,2
s5807,Witches: A Century of Murder,Unknown Director,Suzannah Lipscomb,United Kingdom,"September 1, 2016",2015,TV-14,"TV Show - British TV Shows, Crime TV Shows, Docuseries",53,1
s5808,Glitter Force,Unknown Director,"Laura Bailey, Kate Higgins, Alex Cazares, Colleen O'Shaughnessey, Danielle Nicole, Debi Derryberry, Mary Elizabeth McGlynn, Patrick Seitz, Keith Silverstein",Japan,"August 26, 2016",2016,TV-Y7,"TV Show - Anime Series, Kids' TV",79,1
s5812,Behind Enemy Lines,Unknown Director,Unknown Cast,United States,"August 15, 2016",2001,TV-14,"TV Show - British TV Shows, Docuseries",63,1
s5813,Caught on Camera,Unknown Director,Nick Wallis,United Kingdom,"August 15, 2016",2015,TV-MA,"TV Show - British TV Shows, Crime TV Shows, Docuseries",77,0
s5823,Cocaine,Unknown Director,Unknown Cast,United Kingdom,"August 1, 2016",2005,TV-14,"TV Show - British TV Shows, Crime TV Shows, Docuseries",60,1
s5824,Edge of the Universe,Unknown Director,Unknown Cast,United Kingdom,"August 1, 2016",2008,TV-G,"TV Show - British TV Shows, Docuseries, Science & Nature TV",71,4
s5826,La Esclava Blanca,Unknown Director,"Nerea Camacho, Orián Suárez, Miguel de Miguel, Modesto Lacen, Norma Martínez, Ricardo Vesga, Viña Machado, Andrés Suárez, Natasha Klauss, Miroslava Morales",Colombia,"August 1, 2016",2016,TV-MA,"TV Show - International TV Shows, Spanish-Language TV Shows, TV Dramas",72,1
s5828,LEGO Bionicle: The Journey to One,Unknown Director,"Nolan Balzer, Paolo Bryant, Jacqui Fox, Quinn Greene, Geoff Hughes, Cory Hunter, William Jordan, Corny Rempel, Michael Strickland",United States,"July 29, 2016",2016,TV-Y7,TV Show - Kids' TV,83,1
s5830,Popples,Unknown Director,"Erin Fitzgerald, Wendee Lee, Cassandra Morris, Cindy Robinson, Reba Buhr, Ben Diskin, Ezra Weisz, Karen Strassman","United States, France","July 24, 2016",2016,TV-Y,TV Show - Kids' TV,85,1
s5835,Kuromukuro,Tensai Okamura,"Yohei Azakami, M・A・O, Reina Ueda, Asami Seto, Kaito Ishikawa, Yusuke Kobayashi, Shunsuke Takeuchi, Manami Sugihira, Momo Asakura, Kanako Tojo, Ryohei Kimura, Hikaru Ueda, Taiten Kusunoki",Japan,"July 4, 2016",2016,TV-14,"TV Show - Anime Series, International TV Shows",62,2
s5837,Marco Polo,Unknown Director,"Lorenzo Richelmy, Benedict Wong, Chin Han, Joan Chen, Michelle Yeoh, Rick Yune, Claudia Kim, Remy Hii, Zhu Zhu, Tom Wu, Mahesh Jadu, Olivia Cheng, Uli Latukefu, Pierfrancesco Favino, Jacqueline Chan, Leonard Wu, Gabriel Byrne",United States,"July 1, 2016",2016,TV-MA,"TV Show - TV Action & Adventure, TV Dramas",54,3
s5839,Justin Time GO!,Unknown Director,"Drew Davis, Scott McCord, Jenna Warren",,"June 24, 2016",2016,TV-Y,TV Show - Kids' TV,65,1
s5844,Hibana: Spark,Unknown Director,"Kento Hayashi, Kazuki Namioka, Mugi Kadowaki, Masao Yoshii, Hideaki Murata, Nahana, Sayaka Yamamoto, Shota Sometani, Tomorowo Taguchi, Kaoru Kobayashi",Japan,"June 2, 2016",2016,TV-MA,"TV Show - International TV Shows, TV Dramas",57,0
s5845,72 Cutest Animals,Unknown Director,Unknown Cast,Australia,"June 1, 2016",2016,TV-PG,"TV Show - Docuseries, International TV Shows, Science & Nature TV",85,0
s5846,72 Dangerous Places to Live,Unknown Director,Mitch Ryan,Australia,"June 1, 2016",2016,TV-PG,"TV Show - Docuseries, International TV Shows, Science & Nature TV",75,2
s5854,Cyborg 009 VS Devilman,Unknown Director,"Jun Fukuyama, Shintaro Asanuma, Haruka Shiraishi, Tomoaki Maeno, M・A・O, Hiroki Touchi, Takeshi Koyama, Yu Mizushima, Hozumi Goda, Ayumu Okamura, Saori Hayami, Satoshi Hino, Johnny Yong Bosch, Bryce Papenbrook, Christine Marie Cabanos, Spike Spencer, Stephanie Sheh, Michael Sinterniklaas, Keith Silverstein, Joey Lotsko, Tony Azzolino, Steve Staley, Cristina Vee, Christopher Corey Smith","Japan, United States","April 1, 2016",2015,TV-MA,"TV Show - Anime Series, International TV Shows",85,0
s5856,Justin Time,Unknown Director,"Gage Munroe, Scott McCord, Jenna Warren",Canada,"April 1, 2016",2012,TV-Y,TV Show - Kids' TV,51,1
s5857,Terrace House: Boys & Girls in the City,Unknown Director,"You, Reina Triendl, Ryota Yamasato, Yoshimi Tokui, Azusa Babazono, Ayumu Mochizuki, Kentaro",Japan,"April 1, 2016",2016,TV-14,"TV Show - International TV Shows, Reality TV",78,2
s5863,Netflix Presents: The Characters,Unknown Director,"Lauren Lapkus, John Early, Henry Zebrowski, Kate Berlant, Natasha Rothwell, Paul W. Downs, Tim Robinson, Dr. Brown",United States,"March 11, 2016",2016,TV-MA,TV Show - TV Comedies,79,1
s5864,Your lie in April,Unknown Director,"Natsuki Hanae, Risa Taneda, Ayane Sakura, Ryota Osaka, Saori Hayami, Yuki Kaji",Japan,"March 1, 2016",2014,TV-14,"TV Show - Anime Series, International TV Shows, Romantic TV Shows",49,2
s5867,Cooked,Unknown Director,Michael Pollan,United States,"February 19, 2016",2016,TV-14,TV Show - Docuseries,52,0
s5868,Care Bears & Cousins,Unknown Director,"Michael Sinterniklaas, Michaela Dean, Doug Erholtz, Braeden Fox, Olivia Hack, David Lodge, Nayo Wallace, Ryan Wiesbrock",United States,"February 5, 2016",2016,TV-Y,TV Show - Kids' TV,86,2
s5870,Turbo FAST,Unknown Director,"Reid Scott, John Eric Bentley, Amir Talai, Phil LaMarr, Grey DeLisle, Michael Patrick Bell, Eric Bauza",United States,"February 5, 2016",2016,TV-Y7,TV Show - Kids' TV,45,3
s5871,Masha's Tales,Unknown Director,Unknown Cast,,"February 1, 2016",2012,TV-Y,TV Show - Kids' TV,44,1
s5872,Chelsea Does,Unknown Director,Chelsea Handler,United States,"January 23, 2016",2016,TV-MA,"TV Show - Docuseries, Science & Nature TV",65,1
s5878,Sammy & Co,Unknown Director,Unknown Cast,France,"December 25, 2015",2014,TV-Y,"TV Show - Kids' TV, TV Comedies",88,4
s5883,Atelier,Unknown Director,"Mirei Kiritani, Mao Daichi, Wakana Sakai, Masako Chiba, Maiko, Ken Kaito, Dori Sakurada, Nicole Ishida, Mayuko Kawakita",Japan,"December 1, 2015",2015,TV-PG,"TV Show - International TV Shows, TV Dramas",94,0
s5886,W/ Bob & David,Unknown Director,"David Cross, Bob Odenkirk, John Ennis, Jay Johnston, Brian Posehn, Jill Talley, Paul F. Tompkins, Tom Kenny, Brett Paesel",United States,"November 13, 2015",2015,TV-MA,TV Show - TV Comedies,74,1
s5889,Hemlock Grove,Eli Roth,"Famke Janssen, Landon Liboiron, Dougray Scott, Bill Skarsgård, Joel de la Fuente, Kaniehtiio Horn, Madeleine Martin, Michael Andreae, Penelope Mitchell, Freya Tingley, Laurie Fortier, Nicole Boivin, Ted Dykstra, Lili Taylor, Aaron Douglas, Kandyse McClure, Marty Adams, Demore Barnes, Madeline Brewer",United States,"October 23, 2015",2015,TV-MA,"TV Show - TV Horror, TV Mysteries, TV Thrillers",45,0
s5896,Wakfu: The Quest for the Six Eliatrope Dofus,Unknown Director,"Fanny Bloc, Jules De Jongh, Patrick Béthune, Hugo Chandor, Adeline Chetail, Jessica Bell, Thomas Guitard, Ross Grant, Geneviève Doang",,"October 1, 2015",2014,TV-PG,TV Show - Kids' TV,67,0
s5901,Wet Hot American Summer,Unknown Director,"Elizabeth Banks, Lake Bell, H. Jon Benjamin, Michael Ian Black, Michael Cera, Josh Charles, Bradley Cooper, Judah Friedlander, Janeane Garofalo, Jon Hamm, Nina Hellman, Joe Lo Truglio, Ken Marino, Christopher Meloni, A.D. Miles, Marguerite Moreau, Zak Orth, Jordan Peele, David Hyde Pierce, Chris Pine, Amy Poehler, Paul Rudd, Marisa Ryan, Jason Schwartzman, Molly Shannon, Michael Showalter, John Slattery, Kevin Sussman, David Wain, Kristen Wiig",United States,"July 31, 2015",2015,TV-MA,TV Show - TV Comedies,46,4
s5903,H2O: Mermaid Adventures,Unknown Director,"Sonja Ball, Holly Gauthier-Frankel, Thor Bishopric, Angela Galuppo","Germany, Australia, France, China","July 15, 2015",2015,TV-Y7,TV Show - Kids' TV,52,1
s5909,Danger Mouse: Classic Collection,Unknown Director,"David Jason, Terry Scott, Edward Kelsey, Brian Trueman",United Kingdom,"June 15, 2015",1992,TV-Y,"TV Show - British TV Shows, Kids' TV, TV Comedies",65,0
s5915,Oscar's Oasis,Unknown Director,Unknown Cast,France,"March 15, 2015",2011,TV-Y,TV Show - Kids' TV,94,3
s5923,Lilyhammer,Unknown Director,"Steven Van Zandt, Trond Fausa, Steinar Sagen, Robert Skjærstad, Tommy Karlsen, Fridtjov Såheim, Marian Saastad Ottesen","Norway, United States","November 21, 2014",2014,TV-MA,"TV Show - Crime TV Shows, TV Comedies, TV Dramas",48,1
s5924,Goosebumps,Unknown Director,R.L. Stine,Canada,"November 19, 2014",1998,TV-G,"TV Show - Kids' TV, TV Thrillers",94,0
s5934,The Borgias,Unknown Director,"Jeremy Irons, François Arnaud, Holliday Grainger, Peter Sullivan, Sean Harris, Joanne Whalley, Lotte Verbeek, Colm Feore, Vernon Dobtcheff, David Oakes","United States, Hungary, Ireland, Canada","February 1, 2014",2013,TV-MA,TV Show - TV Dramas,87,1
s5940,The 4400,Unknown Director,"Joel Gretsch, Jacqueline McKenzie, Patrick John Flueger, Conchita Campbell, Chad Faust, Richard Kahan, Mahershala Ali, Billy Campbell","United States, United Kingdom","September 1, 2013",2007,TV-14,"TV Show - TV Dramas, TV Mysteries, TV Sci-Fi & Fantasy",66,1
s5941,Breaking Bad,Unknown Director,"Bryan Cranston, Aaron Paul, Anna Gunn, Dean Norris, Betsy Brandt, R.J. Mitte, Bob Odenkirk, Steven Michael Quezada, Jonathan Banks, Giancarlo Esposito",United States,"August 2, 2013",2013,TV-MA,"TV Show - Crime TV Shows, TV Dramas, TV Thrillers",48,0
s5965,Feb-09,Unknown Director,"Shahd El Yaseen, Shaila Sabt, Hala, Hanadi Al-Kandari, Salma Salem, Ibrahim Al-Harbi, Mahmoud Boushahri, Yousef Al Balushi, Ghorour, Abdullah Al-bloshi",,"March 20, 2019",2018,TV-14,"TV Show - International TV Shows, TV Dramas",61,1
s5975,แผนร้ายนายเจ้าเล่ห์,Unknown Director,"Chutavuth Pattarakampol, Sheranut Yusananda, Nichaphat Chatchaipholrat, Thassapak Hsu",,"March 30, 2019",2016,TV-14,"TV Show - International TV Shows, Romantic TV Shows, TV Comedies",72,1
s5979,Şubat,Unknown Director,"Alican Yücesoy, Melisa Sözen, Musa Uzunlar, Serkan Ercan, Özkan Uğur, Ülkü Duru, Tansu Biçer, Nadir Sarıbacak, Sermet Yeşil, Ayhan Kavas",Turkey,"January 17, 2017",2013,TV-MA,"TV Show - Crime TV Shows, International TV Shows, TV Dramas",96,0
s5985,100% Hotter,Unknown Director,"Daniel Palmer, Melissa Sophia, Karen Williams, Grace Woodward",United Kingdom,"November 1, 2019",2017,TV-14,"TV Show - British TV Shows, International TV Shows, Reality TV",89,0
s5987,12 Years Promise,Unknown Director,"So-yeon Lee, Namkoong Min, Tae-im Lee, So-hui Yoon, Won-keun Lee, Hyo-young Ryu",South Korea,"May 22, 2017",2014,TV-14,"TV Show - International TV Shows, Korean TV Shows, Romantic TV Shows",47,1
s6002,21 Sarfarosh: Saragarhi 1897,Unknown Director,"Luke Kenny, Mohit Raina, Mukul Dev",India,"December 1, 2018",2018,TV-14,"TV Show - International TV Shows, TV Dramas",80,1
s6025,7 (Seven),Nizar Shafi,"Rahman, Havish, Regina Cassandra, Nandita Swetha, Anisha Ambrose, Tridha Choudhury, Pujitha Ponnada, Aditi Arya",India,"July 30, 2019",2019,TV-14,TV Show - TV Shows,43,4
s6027,9 Months That Made You,Unknown Director,Demetri Goritsas,United States,"March 1, 2017",2016,TV-PG,"TV Show - British TV Shows, Docuseries, Science & Nature TV",100,1
s6038,A Good Wife,Unknown Director,"Tien Hsin, Christopher Lee, Darren Chiu, Shara Lin, Blaire Chang, Xi Man-Ning, Chu De-Kang",Taiwan,"January 1, 2017",2013,TV-14,"TV Show - International TV Shows, Romantic TV Shows, TV Dramas",66,0
