show_id,title,director,cast,country,date_added,release_year,rating,content_category,preferences,Cluster
s3612,Misaeng,Unknown Director,"Im Si-wan, Kang So-ra, Lee Sung-min, Kang Ha-neul, Byun Yo-han, Kim Dae-myeong, Shin Eun-jung, Park Hae-joon",South Korea,"August 8, 2019",2014,TV-MA,"TV Show - International TV Shows, Korean TV Shows, TV Dramas",98,0
s3613,Oh My Ghost,Unknown Director,"Park Bo-young, Cho Jung-seok, Lim Ju-hwan, Kim Seul-ki",South Korea,"August 8, 2019",2015,TV-MA,"TV Show - International TV Shows, Korean TV Shows, Romantic TV Shows",88,1
s3614,Reply 1994,Shin Won-ho,"Go Ara, Jung Woo, Sung Dong-il, Dohee, Son Ho-jun, Kim Sung-kyun, Cha Seon-wu, Yoo Yeon-seok, Lee Il-hwa",South Korea,"August 8, 2019",2014,TV-MA,"TV Show - International TV Shows, Korean TV Shows, Romantic TV Shows",59,3
s3615,Reply 1997,Shin Won-ho,"Jung Eun-ji, Seo In-guk, Shin So-yul, Ji-won Eun, Lee Ho-won, Lee Si-eon, Sung Dong-il, Lee Il-hwa, Song Jong-ho",South Korea,"August 8, 2019",2012,TV-MA,"TV Show - International TV Shows, Korean TV Shows, Romantic TV Shows",82,1
s3616,Wu Assassins,Unknown Director,"Iko Uwais, Katheryn Winnick, Byron Mann, Tommy Flanagan, Li Jun Li, Celia Au, Lewis Tan, Lawrence Kao, Juju Chan, Tzi Ma, Cranston Johnson, Mark Dacascos, Kevin Durand, Jeff Fahey, Summer Glau",United States,"August 8, 2019",2019,TV-MA,"TV Show - TV Action & Adventure, TV Sci-Fi & Fantasy",82,1
s3625,No Good Nick,Unknown Director,"Melissa Joan Hart, Sean Astin, Siena Agudong, Lauren Lindsey Donzis, Kalama Epstein",United States,"August 5, 2019",2019,TV-PG,"TV Show - Kids' TV, TV Comedies, TV Dramas",72,1
s3628,Basketball or Nothing,Unknown Director,Unknown Cast,United States,"August 2, 2019",2019,TV-PG,"TV Show - Docuseries, Reality TV",67,1
s3633,Sleepless Society: Nyctophobia,Unknown Director,"Chermarn Boonyasak, Nattapat Nimjirawat, Jason Young, Matthew Deane Chanthavanij, Inthira Charoenpura, Natharinee Kanasoot",Thailand,"August 1, 2019",2019,TV-MA,"TV Show - International TV Shows, TV Mysteries, TV Thrillers",60,4
s3634,The Letdown,Unknown Director,"Alison Bell, Duncan Fellows, Noni Hazlehurst, Sacha Horler, Leon Ford, Lucy Durack, Leah Vandenberg, Celeste Barber, Xana Tang, Patrick Brammall",Australia,"July 31, 2019",2019,TV-MA,"TV Show - International TV Shows, TV Comedies, TV Dramas",80,3
s3637,Twelve Forever,Unknown Director,"Kelsy Abbott, Antony Del Rio, Jaylen Barron, Matt Berry, Bridget Everett, Brandon Wardell, Steve Agee, Spencer Rothbell, Nick Sumida, Ashley Boettcher, Wade Randolph",United States,"July 29, 2019",2019,TV-PG,TV Show - Kids' TV,96,2
s3641,My First First Love,Unknown Director,"Ji Soo, Jung Chae-yeon, Jinyoung, Choi Ri, Kang Tae-oh, Hong Ji-yoon",South Korea,"July 26, 2019",2019,TV-14,"TV Show - International TV Shows, Korean TV Shows, Romantic TV Shows",46,4
s3643,Another Life,Unknown Director,"Katee Sackhoff, Justin Chatwin, Samuel Anderson, Blu Hunt, AJ Rivera, Jake Abel, Alex Ozerov, Alexander Eling, Lina Renna, Selma Blair",United States,"July 25, 2019",2019,TV-MA,"TV Show - British TV Shows, International TV Shows, TV Action & Adventure",55,1
s3645,Beat Bugs,Unknown Director,"Ashleigh Ball, Lili Beaudoin, Charles Demers, Rebecca Husain, Erin Mathews","Australia, Canada","July 21, 2019",2018,TV-Y,TV Show - Kids' TV,87,4
s3652,Sexy Central,Unknown Director,"Jeana Ho Pui-yu, Joyce Cheng, Ava Liu, Shiga Lin, Kelly Chen Jia-li, Eric Suen Yiu-wai, Eric Kwok, Mix, Adam Pak, Patrick Tang",Hong Kong,"July 20, 2019",2019,TV-MA,"TV Show - International TV Shows, Romantic TV Shows, TV Dramas",73,1
s3654,Comedians in Cars Getting Coffee,Jerry Seinfeld,Jerry Seinfeld,United States,"July 19, 2019",2019,TV-14,"TV Show - Stand-Up Comedy & Talk Shows, TV Comedies",78,3
s3655,The Epic Tales of Captain Underpants,Unknown Director,"Nat Faxon, Jay Gragnani, Ramone Hamilton, Sean Astin, Dayci Brookshire, Jorge Diaz, Evan Kishiyama",United States,"July 19, 2019",2019,TV-Y7,"TV Show - Kids' TV, TV Comedies",75,1
s3656,Typewriter,Unknown Director,"Aarna Sharma, Aaryansh Malviya, Mikail Gandhi, Palash Kamble, Jishu Sengupta, Palomi Ghosh, Purab Kohli, Sameer Kochhar, Sara Gesawat",India,"July 19, 2019",2019,TV-MA,"TV Show - International TV Shows, TV Horror, TV Mysteries",76,0
s3657,Rookie Historian Goo Hae-Ryung,Unknown Director,"Shin Sae-kyeong, Cha Eun-woo, Park Ki-woong, Lee Ji-hoon, Park Ji-hyun, Gong Jung-hwan, Kim Min-sang, Choi Duk-mun, Kim Yeo-jin",South Korea,"July 18, 2019",2019,TV-14,"TV Show - International TV Shows, Korean TV Shows, Romantic TV Shows",68,0
s3660,Pinky Malinky,Unknown Director,"Lucas Grabeel, Nathan Kress, Diamond White, Danny Jacobs, Retta, Colleen Smith, Vargus Mason, Lauren Tom, Robbie Daymond, Grey Griffin",United States,"July 17, 2019",2019,TV-Y7,"TV Show - Kids' TV, TV Comedies",92,1
s3661,Unrequited Love,Unknown Director,"Zhu Yanmanzi, Zhao Shunran, Shen Yu, Zhang Yichi, Mengqin, Esther Chen, Zhang Zhehao, He Meixuan, Yuan Baizihui",China,"July 17, 2019",2019,TV-14,"TV Show - International TV Shows, Romantic TV Shows, TV Dramas",56,1
s3664,Angel Beats!,Unknown Director,"Hiroshi Kamiya, Harumi Sakurai, Kana Hanazawa, Eri Kitamura, Ryohei Kimura, Takahiro Mizushima, Shun Takagi, Fuko Saito, Yui Makino, Hiro Masuda, Michael Rivas, Eiichiro Tokumoto, Yumiko Kobayashi, Hiroki Touchi, Miyuki Sawashiro, Chie Matsuura, Kana Asumi, Emiri Kato",Japan,"July 15, 2019",2010,TV-PG,"TV Show - Anime Series, International TV Shows",96,1
s3665,Anohana: The Flower We Saw That Day,Unknown Director,"Miyu Irino, Ai Kayano, Haruka Tomatsu, Takahiro Sakurai, Saori Hayami, Takayuki Kondo, Mitsuru Ogata, Mutsumi Tamura, Asami Seto, Aki Toyosaki, Kaoru Mizuhara, Yui Makino",Japan,"July 15, 2019",2011,TV-14,"TV Show - Anime Series, International TV Shows, Teen TV Shows",73,0
s3666,God Eater,Unknown Director,"Ryuichi Kijima, Hiroaki Hirata, Kazuya Nakai, Sayaka Ohara, Daisuke Sakaguchi, Maaya Sakamoto",Japan,"July 15, 2019",2015,TV-14,"TV Show - Anime Series, International TV Shows",43,1
s3667,GRANBLUE FANTASY the Animation,Unknown Director,"Yuki Ono, Nao Toyama, Rie Kugimiya, Miyuki Sawashiro, Hiroaki Hirata, Yukari Tamura, Kazuhiro Yamaji, Rie Tanaka, Emiri Kato, Tomokazu Sugita, Kanae Ito",Japan,"July 15, 2019",2017,TV-PG,"TV Show - Anime Series, International TV Shows",96,0
s3668,3Below: Tales of Arcadia,Unknown Director,"Tatiana Maslany, Diego Luna, Nick Offerman, Nick Frost, Glenn Close, Alon Aboutboul, Hayley Atwell, Darin De Paul, Andy Garcia, Cheryl Hines, Tom Kenny, Chris Obi, Cole Sand, Frank Welker, Steven Yeun",United States,"July 12, 2019",2019,TV-Y7,"TV Show - Kids' TV, TV Action & Adventure, TV Sci-Fi & Fantasy",67,2
s3670,Bonus Family,Unknown Director,"Vera Vitali, Erik Johansson, Fredrik Hallgren, Petra Mede, Frank Dorsin, Jacob Lundqvist, Amanda Lindh, Marianne Mörck, Barbro Svensson, Ann Petrén, Johan Ulveson, Leo Razzak, Felix Engström",Sweden,"July 12, 2019",2019,TV-MA,"TV Show - International TV Shows, TV Dramas",53,1
s3672,Extreme Engagement,Unknown Director,"Tim Noonan, PJ Madam",,"July 12, 2019",2019,TV-MA,"TV Show - International TV Shows, Reality TV",45,1
s3674,One Spring Night,Unknown Director,"Han Ji-min, Jung Hae-in, Kim Jun-han, Yim Sung-eon, Song Seung-hwan, Kil Hae-yeon, Lee Moo-saeng, Kim Chang-wan",South Korea,"July 12, 2019",2019,TV-14,"TV Show - International TV Shows, Korean TV Shows, Romantic TV Shows",69,0
s3675,PILI Fantasy: War of Dragons,Unknown Director,"Wang Hsi-hua, Lai Wei, Zhang Yu-quan, Chen Yu-kuan, Gao Ming-xiao, Tian Zhi-jie, Li Xiang-yu, Guo Ya-zhen, Zhan Yi-chun, Ye Yu-jia",,"July 12, 2019",2019,TV-14,"TV Show - International TV Shows, TV Action & Adventure, TV Sci-Fi & Fantasy",67,0
s3678,True Tunes,Unknown Director,"Michela Luci, Jamie Watson, Eric Peterson, Anna Claire Bartlam, Nicolas Aqui, Cory Doran, Julie Lemieux",,"July 12, 2019",2019,TV-Y,TV Show - Kids' TV,59,0
s3681,Free Rein,Unknown Director,"Jaylen Barron, Manpreet Bambra, Celine Buckens, Freddy Carter, Caroline Ford, Natalie Gumede, Bruce Herbelin-Earle, Noah Huntley, Kerry Ingram, Paul Luebke, Geoffrey McGivern, Navia Ziraili Robinson, Milo Twomey, Carla Woodcock",United States,"July 6, 2019",2019,TV-G,"TV Show - British TV Shows, Kids' TV, TV Dramas",86,0
s3683,The Legend of White Snake,Unknown Director,"Yu Menglong, Ju Jingyi, Pei Zitian, Xiao Yan, Nie Zihao, Yu Lang",China,"July 5, 2019",2019,TV-14,"TV Show - International TV Shows, Romantic TV Shows, TV Dramas",81,0
s3685,Kakegurui,Unknown Director,"Minami Hamabe, Mahiro Takasugi, Aoi Morikawa",,"July 4, 2019",2019,TV-MA,"TV Show - International TV Shows, TV Dramas, TV Thrillers",60,4
s3686,Stranger Things,Unknown Director,"Winona Ryder, David Harbour, Finn Wolfhard, Millie Bobby Brown, Gaten Matarazzo, Caleb McLaughlin, Natalia Dyer, Charlie Heaton, Cara Buono, Noah Schnapp, Matthew Modine, Joe Keery, Dacre Montgomery, Sadie Sink, Paul Reiser, Sean Astin",United States,"July 4, 2019",2019,TV-14,"TV Show - TV Horror, TV Mysteries, TV Sci-Fi & Fantasy",60,1
s3687,The Last Czars,Unknown Director,"Robert Jack, Susanna Herbert, Ben Cartwright, Oliver Dimsdale, Gavin Mitchell, Elsie Bennett, Bernice Stegers",United States,"July 3, 2019",2019,TV-MA,"TV Show - Docuseries, TV Dramas",45,0
s3688,Yummy Mummies,Unknown Director,"Lorinska Merrington, Jane Scandizzo, Rachel Watts, Maria DiGeronimo",Australia,"July 3, 2019",2019,TV-MA,"TV Show - International TV Shows, Reality TV",40,0
s3689,Bangkok Love Stories: Objects of Affection,Unknown Director,"Apinya Sakuljaroensuk, Kanokchat Munyadon, Gyeon Seo, Nalin Hohler, Thongpoom Siripipat, Chinawut Indracusin, Preeyada Sitthachai, Akarin Akaranitimaytharatt, Adul Charoenrasameekiat, Kanlaya Lertkasemsup",Thailand,"July 2, 2019",2019,TV-14,"TV Show - International TV Shows, Romantic TV Shows, TV Dramas",99,1
s3690,Bangkok Love Stories: Plead,Unknown Director,"Chanon Santinatornkul, Sutatta Udomsilp, Morakot Liu, Varot Makaduangkeo, Sutthatip Wutichaipradit, Cholsawas Tiewwanichkul, Surapol Poonpiriya, Hattaya Wongkrachang",Thailand,"July 2, 2019",2019,TV-14,"TV Show - International TV Shows, Romantic TV Shows, TV Dramas",90,1
s3691,Designated Survivor: 60 Days,Unknown Director,"Ji Jin-hee, Lee Jun-hyuk, Heo Jun-ho, Kang Han-na, Bae Jong-ok, Kim Gyu-ri, Son Suk-ku, Choi Yoon-young, Lee Moo-saeng",South Korea,"July 2, 2019",2019,TV-14,"TV Show - International TV Shows, Korean TV Shows, TV Dramas",87,0
s3692,DreamWorks Kung Fu Panda Awesome Secrets,Unknown Director,"Jack Black, Dustin Hoffman, Dennis Haysbert, Paul Scheer, Randall Duk Kim, David Cross, Jessica DiCicco, Jaycee Chan, Angelina Jolie, Seth Rogen, Tony Leondis",United States,"July 1, 2019",2008,TV-PG,"TV Show - Kids' TV, TV Action & Adventure, TV Comedies",54,4
s3693,Hatchimals | Adventures in Hatchtopia,Unknown Director,"Sam Vincent, Kira Tozer, Andrea Libman",United States,"July 1, 2019",2018,TV-Y,TV Show - Kids' TV,86,1
s3695,Molang,Unknown Director,Bruno Guéraçague,France,"July 1, 2019",2015,TV-Y,TV Show - Kids' TV,70,1
s3696,Rabbids Invasion,Unknown Director,"Damien Laquet, David Gasman, Barbara Scaff",France,"July 1, 2019",2018,TV-Y7,"TV Show - Kids' TV, TV Comedies",63,0
s3697,Record of Grancrest War,Unknown Director,"Kentaro Kumagai, Akari Kito, Yuichi Nakamura, Reina Ueda, Satoshi Hino, Yoshitsugu Matsuoka, Natsumi Takamori, Ai Kayano, Takahiro Sakurai, Wataru Hatano, Yuichi Iguchi, Minori Suzuki, Megumi Nakajima, Yuhko Kaida, Chika Anzai, Yumi Uchiyama, Kaede Hondo, Satoshi Mikami, Ayane Sakura, Ari Ozawa, Tatsuhisa Suzuki, Hiro Shimono",Japan,"July 1, 2019",2018,TV-MA,"TV Show - Anime Series, International TV Shows",54,1
s3701,Scare Tactics,Unknown Director,"Tracy Morgan, Lauren Ash",United States,"June 30, 2019",2011,TV-MA,"TV Show - Reality TV, TV Comedies, TV Horror",70,1
s3703,Dope,Unknown Director,Unknown Cast,United States,"June 28, 2019",2019,TV-MA,"TV Show - Crime TV Shows, Docuseries",91,0
s3705,Exhibit A,Unknown Director,Unknown Cast,United States,"June 28, 2019",2019,TV-MA,"TV Show - Crime TV Shows, Docuseries, Science & Nature TV",79,0
s3706,Instant Hotel,Unknown Director,"Luke Jacobz, Juliet Ashworth",Australia,"June 28, 2019",2019,TV-MA,"TV Show - International TV Shows, Reality TV",52,4
s3708,Motown Magic,Unknown Director,Unknown Cast,"Australia, United States","June 28, 2019",2019,TV-Y,"TV Show - Kids' TV, TV Sci-Fi & Fantasy",60,3
s3709,Paquita Salas,Unknown Director,"Brays Efe, Belén Cuesta, Lidia San José, Álex de Lucas, Mariona Terés",Spain,"June 28, 2019",2018,TV-MA,"TV Show - International TV Shows, Spanish-Language TV Shows, TV Comedies",44,0
s3711,Answer for Heaven,Unknown Director,"Sunny Suwanmethanont, Kan Kantathavorn, Pattarasaya Kreuasuwansri, Chayanan Manomaisantiphap, Suwaphat Techaviriyawong, Prachakorn Piyasakulkaew, Nattarika Thampridanant, Michael Shaowanasai, Pattanachai Adirek",,"June 27, 2019",2019,TV-MA,"TV Show - Crime TV Shows, International TV Shows, TV Comedies",53,4
s3717,Forest of Piano,Unknown Director,"Soma Saito, Junichi Suwabe, Natsuki Hanae, Yuichi Nakamura, Kenn, Aoi Yuki, Mariya Ise, Katsuyuki Konishi, Toshiyuki Toyonaga, Koji Yusa, Hiroshi Yanaka, Ryoko Shiraishi, Yo Taichi, Marie Miyake, Ryo Hirohashi, Motoko Kumai, Maaya Sakamoto, Hideyuki Tanaka, Bin Shimada",Japan,"June 24, 2019",2019,TV-14,"TV Show - Anime Series, International TV Shows",80,0
s3720,Bolívar,"Luis Alberto Restrepo, Andrés Beltrán, Jaime Rayo","Luis Gerónimo Abreu, José Ramón Barreto, Ernesto Benjumea, Félix Antequera, Jefferson Quiñones, Shany Nadan, María José Vargas, Hans Martínez, Mauro Mauad, Álvaro Bayona, Rosmeri Marval, Irene Esser, Nohely Arteaga",Colombia,"June 21, 2019",2019,TV-MA,"TV Show - International TV Shows, Romantic TV Shows, Spanish-Language TV Shows",66,4
s3722,Girls Incarcerated,Unknown Director,Unknown Cast,United States,"June 21, 2019",2019,TV-MA,"TV Show - Docuseries, Reality TV",49,1
s3723,Go! Live Your Way,Unknown Director,"Pilar Pascual, Renata Toscano, José Giménez Zapiola, Santiago Saez, Paulo Sanchez Lima, Carmela Barsamian, Axel Muñiz, Majo Cardoso, Majo Chicar, Gastón Ricaud, Laura Azcurra",Argentina,"June 21, 2019",2019,TV-PG,"TV Show - Kids' TV, Spanish-Language TV Shows, Teen TV Shows",80,1
s3724,Magi: The Labyrinth of Magic,Unknown Director,"Kaori Ishihara, Yuki Kaji, Haruka Tomatsu, Daisuke Ono, Ryohei Kimura, Yoshimasa Hosoya, Takahiro Sakurai, Showtaro Morikubo, Yui Horie, Tomokazu Sugita",Japan,"June 21, 2019",2013,TV-MA,"TV Show - Anime Series, International TV Shows",90,1
s3725,Neon Genesis Evangelion,Unknown Director,"Megumi Ogata, Kotono Mitsuishi, Yuriko Yamaguchi, Megumi Hayashibara, Yuko Miyamura, Fumihiko Tachiki, Akira Ishida, Motomu Kiyokawa, Hiro Yuki, Miki Nagasawa, Takehito Koyasu, Tomokazu Seki, Tetsuya Iwanaga, Junko Iwao, Mugihito",Japan,"June 21, 2019",1995,TV-MA,"TV Show - Anime Series, International TV Shows",50,4
s3726,Shooter,Unknown Director,"Ryan Phillippe, Omar Epps, David Marciano, Cynthia Addai-Robinson, Shantel VanSanten, Tom Sizemore",United States,"June 21, 2019",2018,TV-14,"TV Show - Crime TV Shows, TV Action & Adventure, TV Dramas",88,1
s3727,The Casketeers,Unknown Director,Unknown Cast,New Zealand,"June 21, 2019",2019,TV-14,"TV Show - International TV Shows, Reality TV",65,4
s3728,The Confession Tapes,Unknown Director,Unknown Cast,United States,"June 21, 2019",2019,TV-MA,"TV Show - Crime TV Shows, Docuseries",51,1
s3737,Fate/Zero,Unknown Director,"Rikiya Koyama, Ayako Kawasumi, Sayaka Ohara, Sho Hayami, Tomokazu Seki, Jouji Nakata, Akina Abe, Takumi Yamasaki, Hikaru Midorikawa, Daisuke Namikawa",Japan,"June 15, 2019",2012,TV-MA,"TV Show - Anime Series, International TV Shows",61,1
s3738,Kill la Kill,Unknown Director,"Ami Koshimizu, Toshihiko Seki, Ryoka Yuzuki, Aya Suzaki, Shinichiro Miki, Tetsu Inada, Nobuyuki Hiyama, Mayumi Shintani, Hiroyuki Yoshino, Romi Park",Japan,"June 15, 2019",2014,TV-MA,"TV Show - Anime Series, International TV Shows",48,1
s3742,Puella Magi Madoka Magica,Unknown Director,"Aoi Yuki, Chiwa Saito, Kaori Mizuhashi, Eri Kitamura, Emiri Kato, Ai Nonaka",Japan,"June 15, 2019",2011,TV-14,"TV Show - Anime Series, International TV Shows",91,3
s3743,Somewhere Only We Know,Unknown Director,"Zhang Chao, Li Tingting, Chen Bohao, Sun Jialing, Zhang Zhang, Li Jiuxiao, Deng Yuli, Li Huan, Fang Wenqiang, Gong Rui",China,"June 15, 2019",2019,TV-MA,"TV Show - International TV Shows, Romantic TV Shows, TV Comedies",62,3
s3744,The Alcàsser Murders,Elías León,Unknown Cast,Spain,"June 15, 2019",2019,TV-MA,"TV Show - Crime TV Shows, Docuseries, International TV Shows",51,0
s3745,Unit 42,Unknown Director,"Patrick Ridremont, Constance Gay, Tom Audenaert, Roda Fawaz, Danitza Athanassiadis",Belgium,"June 15, 2019",2017,TV-MA,"TV Show - Crime TV Shows, International TV Shows, TV Dramas",58,1
s3746,Awake: The Million Dollar Game,Unknown Director,James Davis,United States,"June 14, 2019",2019,TV-PG,TV Show - Reality TV,79,1
s3747,Black Spot,Unknown Director,"Suliane Brahim, Hubert Delattre, Laurent Capelluto, Samuel Jouy, Renaud Rutten, Camille Aguilar, Tiphaine Daviot, Naidra Ayadi, Brigitte Sy, Anne Suarez, Dan Herzberg, Olivier Bonjour, Thomas Doret","France, Belgium","June 14, 2019",2019,TV-MA,"TV Show - Crime TV Shows, International TV Shows, TV Dramas",43,1
s3749,El desconocido,Unknown Director,"Guillermo Iván, César Manjarrez, Estrella Solís, Liliana Moreno, Marco Uriel, Mario Zaragoza, Fernando Sarfatti, José Ángel Bichir, Paty Blanco, Pía Sanz, Scarlet Gruber, Pakey Vázquez, Ivonne Montero",,"June 14, 2019",2019,TV-MA,"TV Show - Crime TV Shows, International TV Shows, Spanish-Language TV Shows",41,1
s3750,Girlfriends' Guide to Divorce,Unknown Director,"Lisa Edelstein, Beau Garrett, Necar Zadegan, Paul Adelstein, Janeane Garofalo, Alanna Ubach",United States,"June 14, 2019",2019,TV-MA,"TV Show - TV Comedies, TV Dramas",46,2
s3751,Leila,Unknown Director,"Huma Qureshi, Siddharth, Rahul Khanna, Arif Zakaria, Seema Biswas, Sanjay Suri, Akash Khurana, Ashwath Bhatt, Anupam Bhattacharya, Adarsh Gourav",India,"June 14, 2019",2019,TV-MA,"TV Show - British TV Shows, International TV Shows, TV Dramas",100,1
s3752,Marlon,Unknown Director,"Marlon Wayans, Essence Atkins, Bresha Webb, Diallo Riddle, Notlim Taylor, Amir O'Neil",United States,"June 14, 2019",2018,TV-14,TV Show - TV Comedies,79,4
s3753,Marvel's Jessica Jones,Unknown Director,"Krysten Ritter, David Tennant, Rachael Taylor, Mike Colter, Carrie-Anne Moss, Eka Darville, Erin Moriarty, Wil Traval, Susie Abromeit",United States,"June 14, 2019",2019,TV-MA,"TV Show - Crime TV Shows, TV Action & Adventure, TV Dramas",71,3
s3755,Yankee,Unknown Director,"Pablo Lyle, Ana Layevska, Leonardo Daniel, Javier Díaz Dueñas, Daniel Martínez, Pamela Almanza, Roberto Blandón, Sebastián Ferrat, Gabriela Zamora, Mauricio Pimentel, Julio Casado, Eivaut Rischen",Mexico,"June 14, 2019",2019,TV-MA,"TV Show - Crime TV Shows, International TV Shows, Spanish-Language TV Shows",70,4
s3756,Jinn,Unknown Director,"Salma Malhas, Sultan Alkhail, Hamzeh Okab, Aysha Shahaltough, Zaid Zoubi, Ban Halaweh, Yasser Al Hadi",Jordan,"June 13, 2019",2019,TV-MA,"TV Show - International TV Shows, TV Dramas, TV Mysteries",67,2
s3761,Upin & Ipin,Unknown Director,Nurfathiah Diaz,Malaysia,"June 10, 2019",2011,TV-Y,TV Show - Kids' TV,63,0
s3763,Designated Survivor,Unknown Director,"Kiefer Sutherland, Natascha McElhone, Maggie Q, Kal Penn, Adan Canto, Italia Ricci, LaMonica Garrett, Tanner Buchanan, Ben Lawson, Paulo Costanzo, Zoe McLellan",United States,"June 7, 2019",2019,TV-MA,"TV Show - Crime TV Shows, TV Dramas, TV Thrillers",47,1
s3770,Super Monsters Monster Pets,Unknown Director,"Erin Mathews, Kathleen Barr, Chiara Zanni, Rebecca Shoichet, Sabrina Pitre, Ingrid Nilson, Alessandro Juliani, Elyse Maloway, Vincent Tong",United States,"June 7, 2019",2019,TV-Y,TV Show - Kids' TV,79,4
s3771,Tales of the City,Unknown Director,"Laura Linney, Ellen Page, Olympia Dukakis, Paul Gross, Murray Bartlett, Barbara Garrick, Charlie Barnett, Garcia, May Hong, Jen Richards, Victor Garber, Ashley Park, Christopher Larkin, Zosia Mamet, Molly Ringwald, Daniela Vega",United States,"June 7, 2019",2019,TV-MA,TV Show - TV Dramas,99,1
s3775,Black Mirror,Unknown Director,"Jesse Plemons, Cristin Milioti, Jimmi Simpson, Rosemarie DeWitt, Douglas Hodge, Andrea Riseborough, Brenna Harding, Owen Teague, Andrew Gower, Kiran Sonia Sawar, Georgina Campbell, Joe Cole, Maxine Peake, Jake Davies, Clint Dyer, Letitia Wright, Babs Olusanmokun, Bryce Dallas Howard, Alice Eve, Michael Kelly, Cherry Jones, Gugu Mbatha-Raw, Mackenzie Davis, Wyatt Russell, Benedict Wong, Kelly Macdonald, Faye Marsay, Madeline Brewer, Hannah John-Kamen, Malachi Kirby, Alex Lawther, Jerome Flynn, James Norton, Rory Kinnear, Lindsay Duncan, Daniel Kaluuya, Jessica Brown Findlay, Rupert Everett, Toby Kebbell, Jodie Whittaker, Hayley Atwell, Domhnall Gleeson, Lenora Crichlow, Michael Smiley, Daniel Rigby, Chloe Pirrie, Jason Flemyng, Jon Hamm, Oona Chaplin, Rafe Spall",United Kingdom,"June 5, 2019",2019,TV-MA,"TV Show - British TV Shows, International TV Shows, TV Dramas",78,0
s3779,Documentary Now!,Unknown Director,"Fred Armisen, Bill Hader, Helen Mirren",United States,"June 3, 2019",2019,TV-14,TV Show - TV Comedies,90,1
s3780,Malibu Rescue: The Series,Unknown Director,"Ricardo Hurtado, Breanna Yde, Jackie R. Jacobson, Abby Donnelly, Alkoya Brunson, Jeremy Howard, JT Neal, Bryana Salaz, Ian Ziering, Camaron Engels",United States,"June 3, 2019",2019,TV-G,"TV Show - Kids' TV, TV Action & Adventure, TV Comedies",42,0
s3781,Arthdal Chronicles,Unknown Director,"Song Joong-ki, Jang Dong-gun, Kim Ji-won, Kim Ok-vin, Kim Eui-sung, Cho Seong-ha, Lee Do-gyeong, Park Hae-joon, Park Byung-eun",South Korea,"June 2, 2019",2019,TV-MA,"TV Show - International TV Shows, Korean TV Shows, TV Action & Adventure",68,1
s3783,A Thousand Goodnights,Unknown Director,"Cindy Lien, Nicholas Teo, Yao Ai-ning, Li Chung-lin, Chen Bor-jeng, Miao Ke-li",Taiwan,"June 1, 2019",2019,TV-14,"TV Show - International TV Shows, TV Dramas",59,2
s3785,March Comes in Like a Lion,Unknown Director,"Kengo Kawanishi, Ai Kayano, Kana Hanazawa, Misaki Kuno, Nobuhiko Okamoto, Marina Inoue, Yoshimasa Hosoya, Shinichiro Miki, Tomokazu Sugita, Subaru Kimura, Shigeru Chiba, Toru Okawa, Takahiro Sakurai",Japan,"June 1, 2019",2017,TV-14,"TV Show - Anime Series, International TV Shows, Teen TV Shows",49,0
s3788,Bad Blood,Unknown Director,"Anthony LaPaglia, Kim Coates, Enrico Colantoni, Paul Sorvino, Maxim Roy, Brett Donahue, Michelle Mylett, Claudia Ferri, Tony Nappo",Canada,"May 31, 2019",2019,TV-MA,"TV Show - Crime TV Shows, TV Dramas",81,1
s3790,Killer Ratings,Unknown Director,Unknown Cast,,"May 31, 2019",2019,TV-MA,"TV Show - Crime TV Shows, Docuseries, International TV Shows",53,0
s3793,When They See Us,Unknown Director,"Asante Blackk, Caleel Harris, Ethan Herisse, Jharrel Jerome, Marquis Rodriguez, Jovan Adepo, Chris Chalk, Justin Cunningham, Freddy Miyares, Michael Kenneth Williams, Marsha Stephanie Blake, Kylie Bunbury, Aunjanue Ellis, Vera Farmiga, Felicity Huffman, John Leguizamo, Niecy Nash",United States,"May 31, 2019",2019,TV-MA,"TV Show - Crime TV Shows, TV Dramas",42,0
s3795,Historical Roasts,Unknown Director,"Jeff Ross, Bob Saget, James Adomian, Rachel Feinstein, Jerry Minor, Ayden Mayeri, Jaleel White, Natasha Leggero, Yamaneika Saunders, John Stamos, Nikki Glaser, Seth Green, Fortune Feimster, Jon Lovitz, Mindy Rickles, Gilbert Gottfried, Sasheer Zamata, Brandon T. Jackson, Ryan Phillippe, Ken Marino, Bridget Everett, John Gemberling, Leonardo Nam, Josh Homme",United States,"May 27, 2019",2019,TV-MA,"TV Show - Stand-Up Comedy & Talk Shows, TV Comedies",52,1
s3797,Hyper HardBoiled Gourmet Report,Unknown Director,Kazutoyo Koyabu,,"May 24, 2019",2017,TV-MA,"TV Show - Docuseries, International TV Shows",49,1
s3800,She's Gotta Have It,Unknown Director,"DeWanda Wise, Cleo Anthony, Lyriq Bent, Anthony Ramos, Chyna Layne, Margot Bingham, Ilfanesh Hadera, Elvis Nolasco, De'Adre Aziza",United States,"May 24, 2019",2018,TV-MA,"TV Show - Romantic TV Shows, TV Comedies, TV Dramas",40,1
s3802,WHAT / IF,Unknown Director,"Renée Zellweger, Jane Levy, Blake Jenner, Keith Powers, Samantha Marie Ware, Juan Castano, Dave Annable, Saamer Usmani, Daniella Pineda, John Clarence Stewart, Louis Herthum",United States,"May 24, 2019",2019,TV-MA,"TV Show - TV Dramas, TV Thrillers",96,0
s3807,Prince of Peoria,Unknown Director,"Gavin Lewis, Theodore Barnes, Shelby Simmons, Cynthia Kaye McWilliams",United States,"May 20, 2019",2019,TV-G,"TV Show - Kids' TV, TV Comedies",52,0
s3808,Rosario Tijeras,Unknown Director,"Bárbara de Regil, José María de Tavira, Antonio Gaona, Hernán Mendoza, Vanessa Bauche, Christian Vasquez, José Sefami, Ariel López Padilla",Mexico,"May 20, 2019",2018,TV-MA,"TV Show - Crime TV Shows, International TV Shows, Spanish-Language TV Shows",79,3
s3809,1994,Diego Enrique Osorno,Unknown Cast,Mexico,"May 17, 2019",2019,TV-MA,"TV Show - Crime TV Shows, Docuseries, International TV Shows",92,3
s3813,It's Bruno!,Unknown Director,"Solvan ""Slick"" Naim, Rob Morgan, Shakira Barrera, Jade Eshete, Adriane Lenox, Donnell Rawlings, Eden Marryshow, Sam Eliad, Devale Ellis, J. Ray Acosta",United States,"May 17, 2019",2019,TV-MA,TV Show - TV Comedies,67,3
s3818,White Gold,Unknown Director,"Ed Westwick, James Buckley, Joe Thomas, Lauren O'Rourke, Linzey Cocker, Nigel Lindsay, Lloyd Hutchinson, Lee Ross",United Kingdom,"May 17, 2019",2019,TV-MA,"TV Show - British TV Shows, International TV Shows, TV Comedies",95,3
s3822,Dennis and Gnasher Unleashed,Unknown Director,"Freddie Fox, Kathryn Drysdale, Rasmus Hardiker, Joanna Ruiz, Ryan Sampson, Kelly Marie Stewart",United Kingdom,"May 15, 2019",2017,TV-Y,"TV Show - British TV Shows, Kids' TV, TV Comedies",75,1
